score,review,date
4.4,【平和ボケしてる人間も恐ろしい】ゴジラが現れても楽観的動画を撮って拡散する人責任を取りたくない政治家など命に関わる事件が起きているのに保身とか承認欲求を満たそうとする人間の姿のほうが怖い。こういった皮肉も込められているんだろうな‥---------------------------------------------〈字幕ありで見たほうが分かりやすい〉専門用語や憲法の話が多いので字幕があると分かりやすい。会議シーンが多いから1秒でも見逃すと理解できないかも🤔---------------------------------------------〈テンポが良く無駄なシーンがない〉会議シーンが多くてダラダラしそうかと思ったけど、テンポ良く進むから飽きない。登場人物の心理描写を表情でも表してるから無駄なセリフも特になかった。不要な恋愛要素もなかったから満足。でも無駄とは言わないけど【石原さとみ】ちゃんの役は好きじゃない。途中から「ルー大柴やん」と思ってからは【可愛いルー大柴】として見てた。鼻につく役でした。ごめんなさい。---------------------------------------------〈印象的なシーン〉・ゴジラの破壊光線めちゃくちゃ絶望感のあるゴジラが初めて破壊光線を放つシーン。恐ろしいんだけど、色とBGMのおかげで美しく思えた。まさに神。ラストの尻尾も恐ろしくて神々しかった。バッドエンドかハッピーエンドか人によって感じ方は変わると思う。---------------------------------------------〈まとめ・補足〉・KREVA出てたの気付かなかった・作戦終了後の喜び方がリアル・形態変化するの好き・フランスありがとう#映画好きと繋がりたい#映画好きな人と繋がりたい,2022/11/02
4.0,原作を知らない世代であるため、どのような差があるかはわからない。シンウルトラマンと同様、映像による迫力に圧倒される。現代の特撮と捉えるならば最高級だ。,2022/11/02
3.9,なんだかんだ何度も見ちゃうゴジラ好き。笑アマプラに11月シンウルトラマンが来ると聞いて監督つながりで再々鑑賞自衛隊や米軍の戦闘機や戦車、電車爆弾などなど主に男子のロマンが詰まってるな。かっこいいっすよね！BGMとかめっちゃエヴァだけど。笑ゴジラのビジュアルに不満は残るが人間同士のやり取りの描き方が上手いのがいいですねー。アメリカの女はまじでちゃんとバイリンガル連れてきて欲しかった、キャスティングでそこだけが不満点英語部分がどう聞いても｢英語が上手い日本人｣で、アメリカで生まれ育ったっていうには無理があるし、日本語の滑舌がひどいこれといいシンウルトラマンといい監督は滑舌の悪い女の人がすきなんかなー怪獣映画好きとしてはなんだかんだ何度もも見ちゃう作品ですねー━━━━━━━━━━━━━━━以下過去レビュー━━━━━━━━━━━━━━━2020.6.2コロナの影響で近所の劇場でやってたので再鑑賞。怪獣ものは大スクリーンで見るのが一番！イケオジが大量発生で目の保養でしかない。ゴジラのビジュアルが好きにはなれないが…。蒲田くんの時が一番好きかな。かわいい。使ってる曲も昔のゴジラへのリスペクトが感じられて良い。普段目にする「現実」がしっかり描かれている分、そこに突如現れた「非現実」なゴジラの存在が際立つね。でもしっぽからビーム出すのはやめて…ゴジラは使徒じゃないからさぁエヴァ引きずって混ぜちゃうくらいならエヴァ作ってればいいのに。そこまで強烈な不満はないが、エヴァ好きな人は見ればいいよ、と思う。笑ゴジラ自体が好きな人は、この作品のゴジラについてはうーんって感じじゃないかな？作品としては面白いと思うけど。┈┈┈┈┈┈┈┈┈┈前回のレビューやっぱゴジラ作るのは日本人じゃなきゃねー！と思わせてくれた戦略的ゴジラ映画ただ監督が作中でもパンフレットでもエヴァ引きずりすぎなのと、ゴジラが光線吐く時に顎が割れるのが微妙でも、ゴジラも人間もどっちも応援したくなっちゃう、ってのが本来のゴジラだと思ったるので、とてもよかったです ,2022/11/01
4.5,とても面白かったです。舞台が日本なので感情移入しやすく、常にハラハラしながら見ることができました。序盤の盛り上がる前のパートもアイロニカルな？演出で面白く見れましたし、この展開を見た分後半の展開を爽快に感じられたのかなと思います。あとゴジラかわいかったです。,2022/11/01
3.6,もし現代社会でとんでもないことがおきても、こうやって淡々と事が進んでいくのか…ってゾッとした。,2022/10/31
4.1,誰が見ても楽しめる気はする。私は好きなキャストばかりなので、鑑賞しがいがある。,2022/10/31
3.0,アニメでやってることを実写でやってみましたっていう作品なのかな？実写になった結果、女の子の比率が下がり、おっさんが多くなった。エヴァよりも大衆受けに振ってて好みだった。,2022/10/30
4.0,個性的なキャラクターを演じる俳優さんたちが見事。今まで見たことの演出にびっくりだった。,2022/10/30
0.0,あんなに崩壊したら実際自分ってどこに行くんだろうという気持ちで見てた,2022/10/30
5.0,面白いの一言個人的に政治が軽く絡んでる話が好きだからスコアは満点で友達にもいつも勧めてます。,2022/10/29
4.0,あれ？！こんな終わりだったっけ？！になった。高橋一生最高なので………,2022/10/29
4.0,何喋ってるかよくわからんけどドキドキしておもろかった映画館でみた,2022/10/28
4.5,上陸したゴジラの対処 というシンプルなストーリーラインにリアリティラインをつけた贅沢な味付けという感じ カメラ割やセリフ回しが気持ちよく、ところどころアニメ的な画面がある（特に高橋一生がパソコンもって後ろから駆け寄ってくるところ）完全なハッピーエンドとは言えないがアツい映画 かっこいい とても エンドロールがかっこよくてドキドキしていた,2022/10/27
5.0,もしゴジラが日本に現れたらを描く映画としても面白いし、他の庵野作品とのメタバースで考える考察も楽しめる。ゴジラが現れた時の日本の対応の悪さ、政府への批判的思いや、それが誰のためなのかなど政権に意識があるものには面白く、高齢の偉いお爺さんたちがゾロゾロでてくる感じも個人的に日本映画の面白いところ。自衛隊完全協力のもと、戦車やヘリ、戦闘機などを生で見られるのも良いところ。ゴジラの可愛い、カッコいいという最近のイメージを払拭するような、不気味さ、気持ち悪さを、身近な放射能などと絡めながら作り上げている。メタバースという考えでは、ゴジラがエヴァでいう使徒なのではないか、この後尻尾から使徒が作られ、ファーストインパクトが起きたのではないか、などの考察がとても面白い。庵野作品ならではのカットの多さや撮り方が実写でもとても良い。エヴァの音源が使われるのも良い。しかし石原さとみの微妙なキャラはどうかと思う。位置付けはよいが、不自然さが少し目立つ。全体として無駄がなく常にワクワクしながら見ることができた。,2022/10/27
4.0,特撮が大好きな少年が歳を重ねておじさんになって作ったおじさんのための特撮だった石原さとみが違和感あったからそれがなければもっと好き ,2022/10/27
4.0,前半の絶望感がすごい若い人が頑張ってるのに老いた政治家が無能すぎて腹立ってくる🥲面白かったけど終わりがめちゃくちゃあっさりしてて拍子抜けした。アフターストーリーみたいなのないのかなぁエヴァの曲がそのまま使われてる。らしい。,2022/10/27
4.0,ハリウッドの、B級パニック映画の脚本をCG技術で誤魔化したようなアルマゲドン風「Godzilla」よりは断然いい。随所随所の北野映画のようなアングルもいい意味での邦画らしさを感じさせる。ただ石原さとみの演技はかなりわざとらしい。「外人の女ってこんなもんでしょ？」感が鼻につく。まあ言うほど気にならないけども。,2022/10/27
4.2,知っているところをグチャグチャに破壊してくれたから嬉しかった,2022/10/27
5.0,ゴジラの動きに野村萬斎さんの舞を感じて、脅威のなかに美しさがあった。,2022/10/26
3.7,ゴジラは人類の存在を脅かす脅威であり、人類に無限の物理的な可能性を示唆する福音でもある、ということか言語化された怪獣が持つ神聖さに納得した,2022/10/25
4.5,かっこよくて面白くて考えられる映画2回目はアマプラで見てより丁寧に見れたのでそれもよかった,2022/10/24
4.7,日本映画を逆手に取ったような作品。ダイナミックなことはここぞという見せ場だけで後はちまちま。でもものすごく面白い。オタクが好きそうな感じに作ってあるのか、よくわからない用語が並んだり、キャラの濃い専門家が並んだり、50%くらいしか理解できていないけど淡々とテンポよく進む感じが好きでした。そのオタク好き要素と、何よりゴジラの唯一無二の存在感がすごい！絶対に敵わない相手というのがわかるアングルやゴジラ本体の規模の見せ方。映画を観て数週間は遠くを眺めて「今ゴジラが出現したらこのビルより高いのか…自分死ぬなあ」ってのを妄想してました（笑）,2022/10/24
3.2,テンポよく進んでいくけどみんな早口だし情報量多くて混乱した…笑キャストが豪華。いろんな人でててすごいな〜。石原さとみ、役に合ってなくて英語も頑張ってたけど微妙だったな。映像がスゴすぎる。日本の映画でこんな映像つくれるんだって感動。あと面白いカメラワークたくさんあった。,2022/10/24
4.0,歴代ゴジラが大好きでワクワクしながら観に行ったら理解出来なさ過ぎて15回見直した。まだ理解出来ない。,2022/10/24
2.7,学生のとき、小田急線にずーっと乗りながら観た。小田原から出発して、ゴジラも上陸して、あーあー新宿がー国会議事堂がーーと思いながら新宿に向かうのはオツでした。ASMRのような気持ち良さ(違うかな？)がありながらも、帰ったら防災グッズ見直そう と思える作品。,2022/10/24
4.1,わくわくしましたのでまずは、◯最後は、この、鉄がー*\(^o^)/*,2022/10/24
0.0,久々に見たら面白かった５年経ったから頭良くなって理解できた,2022/10/23
3.7,ゴジラの進化とか、ゴジラと対峙した人間とか国とか、リアルな感じがあって良かった。ゴジラって美しいんやなと思った。,2022/10/23
4.0,めっちゃ面白かった、、、庵野さん、エヴァよりゴジラの方が良いじゃん、、日本の縦割りお役所仕事の面白さも含めて海外の友達にもこの映画見て！っておすすめしたい！！ゴジラが大田区→世田谷区→目黒区移動したあたりで実家はほぼ確実に壊滅的だと思ってしまった笑,2022/10/22
3.4,カットのテンポ良さ・面白さと、ベテラン俳優人の良い味出てるのと、冒頭から早口な展開で、「面白いかも！」と惹きつけられたのですが、石原さとみ演じる変なキャラが出てきたところで一気にチープな印象になってしまいました。自信満々なのに変な発音の英語で気が散って、そのあとはあまり覚えていません。高橋一生や柄本明はじめ他の俳優の方々の演技はお手の物といった印象。,2022/10/22
5.0,始まってからラストまで絶えず面白かった〜〜〜〜〜〜！！！！！明朝体の文字がいちいち出てくるのもなんかエヴァみがあってよかったし、会議シーンのテンポの良さやみんなの早口のセリフもよかったぁ🤣第1形態の深海から現れたばかりで地上に適応してないゴジラから、どんどん進化していくのとか、ミサイルでもびくともしない堅い外皮、とんでもない破壊力を持った放射能ビーム…っていう人類を絶望させるに十分な完全生物っぷりが最高。ゴジラのテーマソングと、あんぎゃーー！って鳴き声もいい…🥺この映画の後に「大怪獣のあとしまつ」を観たくなるよね。観たことないけど！,2022/10/22
4.1,全ての登場人物がかっこいいしテンポも早くて気持ちいいし最高最高最高〜,2022/10/22
0.0,めちゃくちゃ好きな映画の一つ。何言ってるかわかんないことを早口で捲し立てていくのが見ていてテンポとして飽きないし、作品を魅力的にしている。このゴジラ、野村萬斎だと思うと余計面白くなるよな,2022/10/22
4.2,人間と人間の組織の映画。ゴジラの本質はそうなのかもしれないと思わされる。,2022/10/21
4.3,自衛隊がただのやられ役ではなくカッコよくも描かれていたので良かった。政治のシーンが多めで何度も見ようとは思わない。,2022/10/21
0.0,「私を構成する9枚」みたいなのがあるとしたら間違いなく入ってくる映画です。大好きオタクなのでね。早口でよくわからない知識が流れ込んでくるんですが、そういうのが好きな層にはたまらない一本になってると思います。理科の授業で寝てた人には退屈かも。私は授業は寝てたけどこの映画は好きな特異な人間です。まず構造としてリアルとフィクションがくっきりと線引きされている。海からやってくるゴジラがフィクションで、他はほぼリアルだと考えてみることが前提に立っていて、細かい用語や政府などの組織の動きが100%リアリズムに則っているとは言えないが、「我々が暮らしている日本にゴジラが現れた、としたら」という問題提起がこの映画の全てとも言える。だから海外ではあまり跳ねなかったのかなとも思う。舞台は現代日本と地続きで、そこに異物としてゴジラが投入される。映画の見方は人それぞれだけれど、完全なフィクションとして処理してしまうタイプの人は少しだけズレてみる必要があるかもしれない。そういった人にもリアリティを突きつけるだけの迫力と説得力をこの映画は持っているとは思うけれど、政治や災害といったトピックについて自分がどう思ったのか、ということを過去から呼び起こしてようやく賦に落ちる部分が多い。「お前の、お前たちの話をしているんだぞ」といった一種の高慢とも取れる監督のメッセージを私は感じた。しかしそれは監督が「自分の話」として、戦後から2016年までの日本を見つめて出した答えであり、（そこには初代ゴジラが誕生した背景も含まれる）それを基点として我々は日常や来るべき非日常に思いを馳せなくてはいけないのだと思う。,2022/10/21
3.8,石原さとみの謎英語に飛行機の中で驚きつつ爆睡したのから何年も経って、西武園ゆうえんちにも行ったのでせっかくだから鑑賞〜行政の描き方とかおもしろかった！緊迫感をもたせるためなんだろうけど途中早口でやっぱり眠くなった笑,2022/10/20
2.5,みんなが住みたい武蔵小杉が凄いことに‼️ただ、なんか倒し方とかどうなんすか⁉️めっちゃ早口笑😅ちょっと何言ってるか分からないってレベル💦情報量が多過ぎて自分には辛かったなぁ。,2022/10/19
3.0,未知の生物が生じ、それに困惑し対応する政府の動きを描いた物語。ほぼ会話で物語を展開させる構成には凄さを感じ、ゴジラ出現による政府の対応はリアリティのあるものだったが、登場するキャラクターにリアリティを感じなかった。単純なSF作品であれば登場人物のかっこつけたようなセリフなどに違和感は覚えないが、この作品はSFの要素を現代社会に溶け込ませてるため不自然に感じた。ただ対策を練る会議における会話などは迫力があって演技も上手く感じ、楽しめるものだった。その分その他の箇所でのセリフが微妙で、特にパターソンというキャラは日本語が訛ってないのにカタカナ英語が訛ってるというリアリティに欠けた存在で雰囲気と合ってないように見えた。ゴジラの人形に近い造形に怖さはあまり感じなかった。随所に脅威的に感じるような箇所は多々あったが、ゴジラからよりもむしろ焦ってる政府を見てゴジラの怖さを実感した。昔ながらのゴジラを再現しようとしてあのようになったのだろうが、ゴジラの熱狂的ファンでない者からすると人形的な造形を用いた昔は昔だからこそ良かったのであってそれを今で表現すると微妙に感じてしまう。ただゴジラの戦闘シーンは好きで無理矢理さは多少感じたが迫力があって楽しめた。,2022/10/19
4.2,めっちゃ面白かったゴジラが見慣れた東京の街並みを蹂躙していく様子が最高政府のゴジラに対する対応もリアリティ追求してる感じで緊迫感あってよかったゴジラ反撃シーンはガチ神演出,2022/10/19
4.0,2022.10.19#1934大人の映画、シン・ゴジラ。,2022/10/19
3.3,ハリウッドのゴジラと間違えて、こちら鑑賞。セリフが全員棒読みな感じと映像が古すぎて30分で終了しちゃったけど日本の政治のあり方とか憲法の考え方とかそっち目線で見るのはアリかも。。,2022/10/18
3.9,良くも悪くも日本政府の性質が現れてて面白かっためちゃめちゃ縦割り組織で登場人物はゴロゴロでてくるし、専門用語飛び交ってて意味わかんないけど、それがいい初めてゴジラに遭遇した時に焦る民衆すっごくリアルだった。ここ以外にも映像の撮り方が結構工夫されてて、映像とか緊迫感が癖になる！（専門的なことは知らんけど）ゴジラの規格外の強さが気持ちいい～これこそ映画！SF！,2022/10/17
4.9,聞いてた百倍面白い、テンポ良く、緩急つけて常に興奮が襲い掛かる、最高,2022/10/16
4.2,記録初回は情報量に圧倒され、2回目のほうが整理することが出来て楽しめた。庵野節全開で最高でした,2022/10/16
4.1,アクアライン武蔵小杉　多摩川鎌倉　新橋　新宿　などなど見た事のある景色が潰される政府の対応の後手後手感その中でも本気になっている政治家もいる竹之内豊、石原さとみの英語が堪能シンゴジラの神がかった強さが際立つ同時に米国の強さも際立つ,2022/10/16
0.0,やばすぎる。ここ数年観た映画の中で一番興奮したかもしれないくらい、おもしろかった。上に行けば行くほど、考えること・動くことではなくて、聴くこと・承認すること・頭を下げることを求められる感じ、それが本質的に正しいのかはわからないけど、おそらくこれがうまく機能する行政の条件なんだなあと見せつけられた感じがした。賢い下がいることが大前提だけど。谷口みたいに言葉の力を使える政治家は強いしやっぱりかっこいいな〜〜。とりあえず出てくる人が豪華すぎたな。観終わってから野村萬斎がゴジラだったことを知って、かっこよすぎてびっくりしました。,2022/10/16
4.3,政府の対応等々、妙なリアルさが何回見ても面白い。だけど、なんといっても音楽が好き。,2022/10/14
5.0,6年前､この映画が4DX初体験になりました｡俺鎧モスラとビオランテ大好きだからよぉ！ゴジラも好きだから…だから新しいゴジラの表現を見た感じがして面白かった！高校で周りの友達が「君の名は。面白いよね！」「めっちゃ面白かった！君の名は。」って言っててシン・ゴジラが地上波で放送された時に「面白くなくて途中でチャンネル変えたわ」「なんであれが君の名は。と同じくらい話題になったの？」と言われた…でも今､語り継がれているのはシン・ゴジラの方だ！今さら面白さに気づいても遅いんだからね！,2022/10/14
3.0,ゴジラ自体初見なんだけど、最初のやつ思ってた見た目と違った緊急事態への対応組織の難しさ　責任者って大変なるはやかつ探り探りなのがCOVID-19への対応を想起したゴジラ反撃シーンは美しささえ感じたみんな早口　2022-257 ,2022/10/14
4.0,怒涛の展開かつ専門用語が飛び交うから頭がパンクして初回の鑑賞終了しました。「何言ってる？！？！分からんもっかい観る！！！」と3回観てようやく話がちょっと理解できた感じです。これは理解しようと何回でも見ちゃいますわ。,2022/10/13
3.5,現代日本の問題が描かれていて面白かった。早口で専門用語たくさんで、頭に入れるの大変だった,2022/10/13
4.0,公開当時は最高にハマったけど、所々不満もあり…でも日本アカデミー賞受賞という快挙を残してくれました。公開から6年…早く国産実写ゴジラ映画期待してます。,2022/10/13
4.1,vsゴジラのシーンと、政府のシーンのバランスが良い。こういう怪獣映画って戦闘シーンがメインで描かれがちだけど、実際は色んな人が集まって知恵を出し合うはずだから、とても現実的。あと、ゴジラの見た目と能力がやっぱりかっこいい。いくつも形態があるなんて知らなかったから、最初に上陸した時、なに？これがゴジラ？ってビックリしたけど、進化して再度上陸した時は黒くて立派に立つゴジラが...。そして、内閣総辞職ビームが本当衝撃的。全てを貫くし、めちゃくちゃ長いしでチート級。東京を一瞬で破壊した時は絶望したよね。うん。ゴジラ、第5形態に進化しそうだったなあ。この先も見てみたいけど、もはやゴジラではなさそうな気もする🤔,2022/10/11
4.5,ゴジラという災害に立ち向かう日本政府ゴジラ＝荒ぶる神この巨大生物は突如姿を表し、進化を遂げながら東京を壊滅へ。日本政府はそんなゴジラを駆逐するのか保護するのか。守るべきは国民か。政府か。政治的対処を問われるお話ゴジラ初めて観たので、第1形態のゴジラ赤ちゃんみたいで可愛くてこんな感じなんやぁ。と思ってたら迫力満点ゴジラになってトリハダでした。【ゴジラvs日本】今回はこのゴジラという災害にどう対応するか。日本政府の力が試されていました。こんな不測の事態には、総理も焦って、不確実な情報を世に流してしまう。これはドラマ「日本沈没」でも同じようなことがあった気がします。統制の取れない政府に国民は焦り、自分たちの身は自分たちで守ろうとする。これが普通なんですけど、今回はそういう描写はなかったです。スポットライトが国民ではなくずっと政府に当たってた感じですね。でも、ピンチをチャンスに変えていく政府の動きにはワクワクを感じました。ゴジラ駆除のために、原子爆弾を落とそうとしたシーンあれが止められたのは日本映画らしい展開でしたね。アメリカ映画だったら落としてそう。長谷川さんのような人が政府にいたら喜んでついていきたくなるようなそんな主人公でも自分の命も大切にしてほしいです。,2022/10/10
