score,review,date
3.0,シンゴジラが面白かったので、このシンウルトラマンも期待して見たが、残念ながら大して面白くなかった。なぜか。理由は簡単で、4つの逸話のオムニバスになっているからだ。だから話が盛り上がらない。起承転結になっていれば2時間でも3時間でも退屈はしないものだが、このシンウルトラマン、113分はさすがに冗長である。どの逸話も尻切れとんぼなのだ。異星人であるウルトラマンが何故に斎藤工と一体化しなければならなかったのか、何故に地球人に感情移入してしまったのかを、ゾフィーとの会話で本人にしゃべらせるのではなく、映像で表現してこそ「映画」なのである。「シン」ものはどちらもとにかく早口で出演者にしゃべらせるのだが、この手法は好きになれない。小説と映画は違うのである。新藤兼人監督の不朽の名作「裸の島」は全く台詞はないが異次元の感動を味わうことができる。庵野氏はもう少し「映画」というものを勉強しなおしたほうが良い。,2022/10/18
3.3,シン・ゴジラの方法論で撮ったウルトラマンを期待して視聴。それっぽいところはあるが、肝心なものがない。シン・ゴジラでの蒲田くんのような驚きがない。メフィラスやゾーフィ、ゼットンの解釈がそれに当たるはずなんだろうけれど。衝撃度が弱い。,2022/10/18
4.2,全般的にテンションが低いし、スピード感もない。盛り上がりもないし、淡々と物語が進んでいく。期待外れだと思いながら見ていたが、地球侵略しようとする宇宙人相手になってからテンションは変わらないのだけど、面白くなっていく。昔のウルトラマンのシーンを踏襲しながら、上手く物語が構成されていて感心した。,2022/10/16
5.0,ウルトラマンは、誰しも子供のころに見たことがあると思う。実はウルトラマンの放送開始は私が生まれたころだった。このシン・ウルトラマンは子供たちと観た。（私は晩婚で）子供たちは小学生低学年で奇しくも私が子供のころにみたのと同じ世代だ。彼らは令和・平成ウルトラマンに慣れ親しんでいるためか怪獣の名前は一目でわかる。舌を巻くが私も子供のころは怪獣図鑑を覚えたものだ。しかし私はすっかり忘れてしまった。彼らはシン・ウルトラマンがかっこよくて面白かったようだ。地球を守る正義のヒーロー。ゼットンがとくにかっこよかったらしいただし大人が観るとウルトラマンの使命はヒーローとしてきた者なのか疑問だし、ゼットンはそもそも怪獣なのか？と色々と思うところがあった。ただしウルトラマンの印象と物語の深みは、世代を超えて伝わったと感じている。子供たちももう少し成長すれば解釈もかわってくるだろう。でもあの時えいがかんでみたカッコいいウルトラマンへの思いは私と同じで永遠なんじゃないかって想いたい,2022/10/16
3.0,期待を持ちすぎたからか、物足りない感が、どうしてもあるなあ…。あと、タキくんは、君の名はを連想しちゃうのよ,2022/10/16
1.0,2022/10/16最高に面白かったです！高校生の時の映画監督になりたいという夢は今からでも遅くないと思わせてくれました！！,2022/10/16
3.7,"『シン・ウルトラマン』鑑賞。評判見てると苦手そうな感じしてたけど、最初20分ぐらいの""私は何を見ているんだ""感に慣れたら楽しめた。あとアップが多いからこそわかる長澤まさみの顔面の良さが凄い笑",2022/10/16
4.2,平日昼間の鑑賞でしたので客は50代から60代の頭の白いおっさんばかりでした(笑)。やはり私たちの世代には人気があるのですね。冒頭いきなり「ウルトラQ」のオープニングテーマ曲、それからから「シン・ゴジラ」のタイトルから始まったのはシビれました。日本において巨大不明生物が次々に出現し、政府・自衛隊はその駆除にあたるという説明が、６体の怪獣とともにいっきに早いスピードで映し出されるのですが、まさに庵野ワールド全開です。この部分までは、まだウルトラマンが出ていなので「シン・ウルトラQ」って感じですね。本編は5部形式になっていて、TVシリーズをつなげたような工夫がなされています。メフィラス星人、ゼットン、ゾフィーと出てきて思いっきり楽しませてくれます。これはまさにウルトラマンが好きな人が作ったウルトラマンですね。ウルトラQ の放映開始が1966年1月、ウルトラマンは1966年7月ですから、56年の時をへて今回の「シン・ウルトラマン」。私はマニアではありませんが、こういうのを観ると、つくづく日本人で良かったと思ってしまいます。「怪獣はなぜか、この国にしか出現しないんだ」(笑)鑑賞後は映画館と同じビルに入っている喫茶館キーフェルグローバルクラブで珈琲をいただきながら、パンフレットを読んでニヤニヤしてしまいました。,2022/10/15
4.0,スタッフクレジット見てて、円谷一族は既に欠片も居ないんだと思った次第。物心ついたときには第一次怪獣ブームは終わってる頃で、特撮の一番古い記憶は「怪奇大作戦」とか「河童の三平」とかだから、再放送で観たんだろうなあ。それでも子供時代の憧憬と共に観てしまうわけで、そういう+αありつつも面白かったです。神永隊員がオリジナル版のハヤタ隊員のように、浦島太郎にならなくて良かったなあと思いました。有岡くんがとってもおいしかったのが、少し嬉しかったり。同じグループで同時期くらいに公開で、ラストで変身までした山田くんの立場は？　とか思っちゃいました。マルチバース展開はさらりと説明してたので、今後の展開が気になります。,2022/10/15
3.5,長澤まさみ氏がでっかくなっちゃった！！映像美や艶はさることながら、興味深い台詞も満載でした。「割り勘で良いか、ウルトラマン？」何事も平和的解決が一番だ、恫喝は人間の良くない所業だ。庵野秀明監督の自身の映画のオマージュ。ゾフィーとゼットンとが同一体なのが違和感でしかなく、悪役は結果、人類の方ではと考えさせられました。ラストは唐突な終わりかなと。映画「シン・仮面ライダー」も楽しみ。,2022/10/15
3.7,2022/21通常のウルトラマンの動きを沢山見てきたから、モーションキャプチャのウルトラマンがものすごーーーく違和感。アクターさんが動く人間味と、また違う人間という感じで不思議。斎藤工である必要があったのかは謎だし、長澤まさみのあのアピールは一体何なんだ……色んな人に聞いても、とにかく「シン」シリーズということで納得しよう、という結論にしかならず、「シン仮面ライダー」に行くためのイントロだったと考えることにした。けど、そこまで悪いものでもありませんでした笑,2022/10/14
3.0,一言で表せば「温故知新」ですかね。うん、1960年代に発生していたウルトラマンに関連する事件について、リアリティーを追求するならば、あのようになりますよね🤔それはわかります。先に良い面を。単純に懐かしいですよね。原作が大好きな私としては、科学特捜隊の歌や、ウルトラマンの戦闘シーンの曲を聞くと、盛り上がります。本当に、ウルトラマンが地球上でスペシウム光線を放てばそれは危険ですよね。確かスペシウムってバルタン星人曰く、そもそも放射性物質だったと思ったけれど…🤔空想科学読本を思い出しながら見てましたもの。。ノスタルジックに浸れるかな、と思います。ここからは少しネガティヴな話になります。この感想はあくまで原作が好きな人間の感想の一つに過ぎないため、あまり参考にしないでいただいた方が良いかもしれません。原作好きは概して、リメイク等に物足りなさを感じる、これは致し方ない面もあるでしょうしね💦さて。やはりエピソードがぶつ切りなんですよね…。地球人とウルトラマンの関係を考えたらやはり、これは唐突感が否めないんです。だから、レビューすることをためらっていました。劇場で見てきて、違和感を感じるも、今まで言語化出来ず。ウルトラ警備隊キリヤマ隊長の、我々地球人の手で守る発言から、ウルトラマンメビウスでの事件史で紡ぎ上げてきた、ウルトラ兄弟と地球人の関係性を思うと、本作で単純に信じすぎる地球人などに違和感があるといいますか。。いや、求めてはいけない部分なんでしょうけれども。但し、ゾフィの設定、これは熱い🤣当初はこんな設定だったらしいですね笑だから、当時のエピソードを盛り込んでいるんですよね、それは面白かったですね。,2022/10/14
3.8,巨大化よ 話は普通に面白かったシン仮面ライダーに期待見たのだいぶ前だからまたレンタル始まったら借りよっかな,2022/10/14
5.0,ことしで22さいになる そんなぼくがきみとであったのは もういつのころかおぼえていないあかとぎんいろのせなかに ぼくはむちゅうになったどれだけきづついても どれだけうちのめされてもなんどもなんどもたちあがって あくとたたかうきみをみてぼくもきみみたいに つよくなりたかったなにもかもに あこがれてたそこには ひーろーがいた,2022/10/14
1.0,驚きもせず創造通リのクォリティーです。音楽もダサく（ワザと？）パロディで作ったのかなと思いました。緊張感はまったくゼロです。皆、優しいよね～ぇ。他の評価は良いです。８歳以上禁止映画ではないでしょうか？たぶんマニア向けの作品なので素人の私には無理な映画でした。別に非難されても良いと思ってるので私を攻撃して下さい。でもウルトラマン見たいに応戦しません。無視で良かったどうぞ。最新映画ブログ紹介↓https://www.yellowbaku.shop/,2022/10/13
3.8,出だしから好きすぎる笑笑ただシンゴジラと比較すると製作費をあまり出してもらえてないのがすぐわかるCGではあったゼットンに関しては賛否両論あると思われる、個人的には好きどことなく最後の戦いはウルトラマンコスモスVSウルトラマンジャスティスが好きな人は全然ありな展開なんじゃないかなと思います。ウルトラマンやアクションだけでなく登場人物たちも良いキャラ出してますね、特に長澤まさみさん映画鑑賞した人はどうにかして見たいものがあるのではないかなーと🙄,2022/10/12
3.6,庵野監督ならではのテイストが敵のキャラクターに現れていた。現代の設定であるが、随所に原作へのリスペクトが込められており、それが良いレトロ感を出していた。ストーリー展開はテンポ良く、役者さんたちの演技も絶妙で良かった。非現実的で空想的な設定であるが、物語の核は善、正義、愛などだと伝わって来た。,2022/10/12
3.7,(個人的に)難しい言葉がいっぱい出てくるので字幕つきで観たいと思った,2022/10/11
3.6,そんなに人間が好きになったか、ウルトラマン。ジョワッ‼️,2022/10/11
2.0,往年のSF特撮ヒーロー「ウルトラマン」を現代の世界観に置き換えたリブート作品。大して深くも重くもない人間（？）パートのやりとりがゴチャゴチャ長すぎるから映画としての爽快感に欠けると言うか何と言うか…w情報量は多いが中身は薄い…その程度の感想しかないかな…,2022/10/11
2.5,スペシウム光線の演出が凄すぎた！ウルトラマン詳しくないけどわかりやすい話だった,2022/10/10
4.0,こちらでは初めて書きます面白かったですまあ残念な所もいくつかありますがゼットンがイマイチでしたねゼットンをそういう使い方をするのはアイディアとしては理にもかなって面白いと思うのですがそれでもゼットンはゼットンにしてほしかったかなゼットンに関しては、それプラス戦いのアッサリ感もあって60点、今風ゴチャゴチャ鋭角的なデザインは30点くらいでしょうかザラブのデザイン(アイディア)はすごく良かったのに・・・あとメフィラスも、オリジナルの、目が４つあるようなデザインが良かったのになあボディーのスマートなタイツ感も、知的な異星人っぽさは出るけどなんかイヤ(笑)禍威獣という呼び名も理由はあるのだろうけどそういうアレンジはあまり私の好みではなかったですし特にそれがギミックになってるとも感じなかった総合すると、今回はウルトラマンで成立させる話でしたがオリジナル特撮にした方がよかったかもまあそうすると単にエヴァになる可能性があるし、看板無いと予算も出ないし客の入りも落ちるだろうけど、あれだけアレンジするならそっちでもよかったかもしれない(元々エヴァもウルトラシリーズ等の特撮を近代アニメでやってみようというオマージュ作品でしたもんね)あとBGMも統一性がないというか、メフィラス戦の安っぽい垂れ流しロックが気になったのと神永から預かったUSBの事言うの遅過ぎね？ってことくらいですかねただ重ねて言いますが、その辺は些細なことで、押さえる所は押さえてて面白かったです予算的には日本映画の枠を出ない感じなのはわかってしまうが、ダレることもなく飽きずに見れました予算の使い所や、脚本、見せ方が上手いからでしょう(ちょっとアングルがしつこい気もしましたが)私的には日本映画界全体で考えても賛否はあれどトップクラスにまともな映画を撮ってる人たちに見えるし商業的に見てもヒットメーカーだと思うのに、なにゆえ予算を渋るのだろう？(町山智浩さんいわくラジオで、日本映画の興行収入はヒットしても30億くらいだから大作でも製作費の上限は3分の1の、10億が限界だとは言ってましたが、スポンサーはマニュアルでそれを律儀に守ってるって事なのかしら？レビュー見ると単に「CGが…」と言ってる人も多いので残念な事です)ハリウッドは30億で低予算なのに…あと、書くかどうか迷いましたが、例の長澤おしり問題なんですが、私も癖でよくひじのシワシワの部分を触ることがあるんですが単にそれのおしり版というだけで、そういう癖を持ったキャラクター表現なんだなあ、としか思わないので長澤さん以外が「セクハラだー」はちょっと違うと思うのだがただ、それとは別の話として、すごい違和感は感じるそれは、このキャラ付けが別にいらないからですおしりを触ったきっかけで彼女が活躍する展開がある訳でもなしキャラ付けとしても弱いし古い、というかキャラ付けのためのキャラ付けに見える「ん？」とテンポが止まりいちいち引っかかるだけで正直ただただ邪魔であることは確かですそんなことしなくても充分キャラはあると思うのに恐らく描きたいものを描こう！という情熱がありきのただそれだけで描いた80年代アニメみたいなノリなんでしょうね。まあそれは大事なことではあるんですが。あともう一つの違和感として実写だからというのもあると思うアニメだとこういうキャラ表現も受け入れられると思うのですが実写だと生臭くなる昔、キムタク主演の宇宙戦艦ヤマトの実写映画があったのですがアニメだと何とも思わなかったけど、実写で、しかも日本人で軍隊を絵描くと、とても陰陰滅滅とした生臭さが漂ってくる多分この臭いに気付かずこのアイディア入れたんでしょうね。,2022/10/10
3.0,あまり覚えてない。なんか長かった気がする。巨まさみがもう少しやりようあった気がする。,2022/10/10
3.9,これも大分前に観た作品！期待通りのウルトラマン！このゆるいやりとりが、ウルトラマンって感じで、うまく表現されていてよかった！怪獣との戦いも初代ウルトラマンの戦い方でしっかりいい所を残して、今の映画になっているのが良作でした！居酒屋のシーン、こんな感じで隣に宇宙人がいたらって思うリアル感がよかったです！ゾフィーがもう少しカッコよく表現してほしかった〜、宇宙警備隊隊長！めちゃ好きだから、もう少しカッコよくって感じでした。全体的にはエンターテイメントとして、ばっちりな作品でした！,2022/10/10
3.8,庵野監督作品なのか？と思わせるような演出が多数、いいのか、悪いのか俺は好き,2022/10/10
4.0,オタク心を擽る演出が良かった。シン・ゴジラを見てからみると、前回のキャストがスライドしてるのも良かった。,2022/10/10
4.0,最新の技術と懐かしいかんじ、カメラワーク、最高でした、、ウルトラマンの世代ではないし、ちゃんと観たことはないけど、お父さんがウルトラマンや仮面ライダーが大好きでね、なんかお父さんの気持ちわかったような気がする。たくみさんのウルトラマンかっこよかった！,2022/10/10
3.0,変身の音とかBGMとか昔のままで懐かしかった。スタイリッシュなウルトラマンはめちゃんこかっこよかった。戦闘シーンのカメラワークも庵野監督らしくてよかった。でもちょっとシリアスすぎ。セリフも科学的な言葉が多すぎて理解しずらい。最後のゼットンもなぁ、あんなんじゃない方がよかったなぁ。戦闘シーンがもっと観たかった。,2022/10/10
5.0,ウルトラマンをほぼ知らない状態で見てこんなに面白いなら父親とかの世代はこれみたらどうにかなってしまうんじゃないか,2022/10/09
1.5,うーん、なんかガッカリ。一言で例えるなら…ゴーストのない人形。樋口監督は樋口監督。どんなに真似しても、庵野監督本人にはなれないのに、なんでこんな作り方にしたんだろ。ウルトラマンをエヴァ風にアレンジしてみた（？）庵野監督に憧れる、どこぞの石油王が、大枚をはたいて作ったオタクムービーみたい。ヒューマニズムが全然ない（レヴィ＝ストロースから借用しても、これじゃ…）表面的なパッチワークで、無駄が多くて素人っぽい。特に、アングル。独善的で形骸化している。庵野監督は、実相寺昭雄監督や岡本喜八監督などから学びながら、独自の思想を構築して、形骸化しないよう作品に魂を吹き込むが、樋口監督の本作にはそういった形跡が見られない。オマージュやリブートのつもりで、シンと銘打っているのだろうけども、斬新な解釈が何もないコピー＆ペースト。記号化されたオリジナルなきコピー。言い換えれば、二次創作物。唯一、印象に残るのが「進撃の巨人」化した長澤まさみって…。セクハラ目的で、でっかくしたのかな。,2022/10/09
3.6,シンウルトラマン？真ウルトラマン？新ウルトラマン？まぁやはりこの場合シンなのでしょうね😅トップガン同様往年のファンの期待をちゃーんと拾ってくれてる作品だったと思いますトップガンは続編シンウルトラマンはリメイク？でも　ちゃんと初代ウルトラマンでした！音楽も効果音も　当時のなにやら薄暗く不気味なカメラ割りとかも　ちゃーんと初代ウルトラマンの世界観でしたね👌なぜカラータイマーがないのかウルトラマンはカラータイマーないとなー！😩と思ってましたけどそれもある程度ちゃーんと納得のいく設定になってました色々あるけど細かいとこを少しだけ四つ足の怪獣(禍威獣)とかだとどうしても後ろ足が着ぐるみだと　膝を曲げてる感じがあるのを　CGなのにちゃーんと再現してるとことか泣けてくるこだわり😂もちろんウルトラマンのスーツのシワとかも　初代ウルトラマンより全然ピカピカ✨光ってるのにシワはちゃーんとあるとことかいいよねー😂ただ！どーーしても納得いかないとこがひとつ！ウルトラマンと言えば「シュワッチ！」「ヘアッ！」でしょーーよ！！これを言わないんだよなー！😵なんかのこだわりがあるのかもだけど　やーっぱりウルトラマンは「シュワッチ！」でしょー！それを言わないのはブルース・リーが「アチョー！」を言わないのと同じ！やはり物足りない😵それ以外は　合格点💮でした斎藤工も山本耕史も　長澤まさみもなかなか良かった他のキャストも良かった次回作もあるようでそのときは是非ともセブンも登場させて欲しいものです😋,2022/10/09
3.5,機内鑑賞レビュー最後です。宣伝してた時から、日本へ行ったら絶対観る！と決めてて、機内で観られたんで夫婦揃って、すぐに鑑賞。世代的にはハマれる世代なんですが、正直子供の頃も見たことがないので、なかなか入り込めませんでしたね。でも昭和チック？なところが、面白かったです。あと、長澤まさみさんのキャラがスベってるところ？（ぉぃファンとしては、ツッコミどころがあるんでしょうが、おばちゃんとしては、楽しめたのでヨシです！,2022/10/09
3.5,見た、記録してなかったので、今頃記録してます。久々に、ウルトラマンを懐かしく思い出した。斎藤工がウルトラマン笑顔なくやっていた。感情がない感じ、ウルトラマンだからかな？ウルトラマンってシュワッチ以外喋らないんだったけど、今思うと不思議なことに思える。子供の頃大好きで毎週、金曜日に見てた記憶がうっすらとあるウルトラマンだがあんなに見てたのに、内容はほとんど覚えてなく、スペシウム光線で3分以内に怪獣をやっつけるってこと以外細かい設定を覚えてない。怪獣可哀想だななんて子供心にやっつけられる怪獣のことを思っていた記憶があるぐらい。どうして人がウルトラマンになったのか、なぜ地球人になって怪獣が来たらやっつけるのか？M35星雲？からだったけ？やって来た理由はさっぱり分からない。地球を征服して住めるようにするため？そしたら、怖い宇宙人だったんだよね。はてさて？なんていろいろ考えるきっかけとなった。巨大化した長澤まさみは、圧巻だった。服も靴も何もかも大きくなる、ドラえもんの道具みたいだった。なんに役に立つかな？,2022/10/08
3.0,コロナ終了しそうで映画観賞再開気味なので記録も再開ーかなり前なのでおぼろげーなのだけどもうちょっとCG使って本物っぽくしたらよかったのに。って感じでした。昔風はワザとなのか？,2022/10/08
