score,review,date
5.0,ゴジラ映画が嫌いな私が、楽しめた作品ゴジラという巨大な生物に、人間たちがどのように考え、対処していくのか！にスポットを当てている点が特にいいです。豪華俳優陣も最高でした。,2022/10/10
3.6,面白いけど、昔のゴジラ対モスラやキングギドラ、メカゴジラとかにはかなわない。,2022/10/09
0.0,記録巨災対のメンバー、好きな俳優さんばかり。主人公の名前が蘭堂って珍しいことには何か意味があるのかな。,2022/10/09
3.5,ちょっと難しい。ゴジラの迫力もさることながら、日本政府の対応が中心に描かれていた。ドラマの日本沈没を彷彿とさせた。ゴジラを今後起こりうる未曾有の災害に見立てて考えてみた。,2022/10/09
3.7,面白い！あと蒲田くんかわいい笑ただ、石原さとみの演技というかキャラに共感性羞恥発動してしまった。。,2022/10/09
4.3,「虚構vs日本」というキャッチコピーが天才すぎる。ゴジラがまさに「ぼくが考えた最強のゴジラ」で、そんな出鱈目な「神の化身」に現代日本がどう立ち向かっていくのか。展開のテンポも良くて非常に面白かった。,2022/10/08
4.3,みるの渋ってたのが惜しいなと思ったくらいにはよかった。変な邦画感が無くむしろ日本だったからよかったと思う話だった。,2022/10/08
3.1,人気あるけどどうも自分は入り込めなかった。馴染み深い世田谷の街が壊されるのはリアリティがあって怖いけど、スタスタ歩きながら会話する官僚達や石原さとみがどうも無理。,2022/10/07
4.1,ある意味ゴジラ救世主なのでは？ あーあ、アベンジャーズいたらなぁ,2022/10/07
4.0,独特なカメラワーク（動く椅子の上にカメラを載せたカット、机の脚元からその先を写すカット） や、放射線構図、前ボケが多いイメージ。ゴジラ出現後の緊急会議、首相の頼りなさ、大臣達は秘書のメモを読んでいるだけで生物学者も的外れな回答（そのような演出）ゴジラの上陸後の出血は原子炉と同じように、血液により体温を下げるためという凝った演出。防衛出動の施行決定のシーンなしでニュースで思考されたことを表示するなど、見せ方が上手かった。ゴジラが海に帰ったシーンは映さず、背中の赤い部分の発光シーンの後「東京湾に移動中」というセリフで帰ったことを表す。考えられない、ありえないがありえる世界 話題になった事をその次のカットで詳しく掘り下げる 首相の、どこまで言っていいんだと確認後しっかり守っている様子もまた無能さの表現に近いものがあると感じた。「ごちそうさまでした」から始まるカットがある意図はなんだろうか。2度目の登場シーンでは進化シーンはカットされていた。2回目はくどいからだろうか。ミサイルが目の近くに来たとき、目が白目を剥くゴジラ。これも細かくも凝った演出。放射線測定員のタイマーが鳴るのもわざわざ入れなくてもいいが庵野さんのこだわりなのかも知れない。「こんなことで歴史に名を残したくはなかったなあー」と言う緩いくらいのキャラが1人出てくる事で緊張と弛緩を上手く使っているように感じた。,2022/10/06
3.0,エヴァ好きとしてはとても楽しめた。電車で攻撃するシーン、何とも言えない哀愁漂う。,2022/10/06
0.0,国（官僚）vsゴジラ（災害・核）アメリカとの関係性緊急事態に対する意思決定の遅さ,2022/10/05
1.0,専門用語早口で何言ってるのかさっぱりわからん。軍事オタクには最高なんでしょうけどね。つまんない。,2022/10/05
4.0,正直なことをいうと他の怪獣と戦っているゴジラのさくひんが好きだけど、これはこれで良かった。,2022/10/05
3.8,石原さとみクッソいらないけどサブリミナル的に被爆地の写真うつるのゾクゾクした,2022/10/04
2.0,庵野秀明にシンシリーズが任されているのなら当然そうなるわけで、それ前提だからこそそれらしい部分に対していちいち文句を付けるような真似は無粋でしょう。ストーリーは展開が早いがよく作り込まれてました。長谷川博己はじめ、キャストの演技力が凄まじかったです。CGもキレイでした。全部含めて「ゴジラ」というコンテンツとして見た結果はこうです。庵野秀明のゴジラでした。,2022/10/04
4.0,エヴァ好きなら見るべきとのことで勧められ、今更ながら鑑賞。とてつもなく切ない気持ちになったのは恐竜好きだからか人間嫌いだからか何かはわからないが最後のGODZILLAの姿が悲しかった、、、人間って野蛮。,2022/10/04
4.1,ゴジラが実際に出現したらこんな感じなんだろうなと子どもながらに思った,2022/10/03
4.6,何度観ても滅茶苦茶に面白い！庵野秀明式 虚構VS現実のマッチメイク。ゴジラを国に降り掛かる理不尽の象徴として描き、矢継ぎ早に展開される人類の抵抗の数々を抜群のルックで形取っていく手腕は実に見事。日本映画史に名を刻むに相応しい往年の名作です。現代日本を舞台としたVS怪獣映画としてのゴジラのウェルメイドな躍動的な映像も最高ですが、その作劇の中にしっかりと日本人の気質を織り込んだ上で、実存感を限りなく高めているのが無二の味わいで大変良い。、初代への目配せも忘れない、絶妙なバランス感覚で構築された一本。情報量の多さを話もして詰め込んで成立させた上で、ただ国の為に最善を尽くす人々を魅力的に描く視点の愛らしさも庵野秀明ならではの味わいで綺麗に作家性が噛み合ってるのも高評価ですね。,2022/10/02
5.0,私がこの世で1番好きな映画。ゴジラも庵野さんにも全く興味がなく、高橋一生に釣られて見たらまんまと作品に引き込まれた。生まれて初めて映画館に8回観に行った作品。,2022/10/02
3.5,2017/10/5鑑賞早閉じる口大会。優勝は市川日美子。彼女の役柄も良かった。石原さとみは役柄が可哀想だった。あれは誰がやってもサブくなるって。てか長谷川博己はカッコいいわ～,2022/10/02
4.0,いきなり現代に大型恐竜現れたら、皆んなどうする？視点。特に日本の政治構造と日本人の気質をうまく表している。そうそう、そうなるよねぇって思わず思えるくらいのリアルさがある。ゴジラの真の姿じゃないの？いえいえ真にゴジラが出現したらでシン•ゴジラ,2022/10/02
3.8,ゴジラ倒した後「はあ〜…」みたいに気抜けていく様子が日本の社会を上手く表現してるなと思った。海外の映画だったら「イエーイ！ってお祭り騒ぎになる。,2022/09/30
4.2,エヴァ好きの私には、すごくおもしろ作品だった。実際にゴジラのような未確認生物が急に現れたら、政府はこんな対応をするんだろうなあと思える、リアルな演出だった。ルールや組織のしがらみで、なかなか思うように動けず、最終的には隣国や、世界各国が口を出すようになっていく流れも、リアルだった。世界各国に原爆使用を半ば強制的にすすめられるなか、最後まで希望を捨てず戦う姿がかっこよかった。私は高橋一生が目的で鑑賞したのだが、たくさんセリフがあるわけではなかったが、彼らしい、いい味を出しているキャラクターで、そこもまた良かった。,2022/09/30
4.8,初めて見た時斬新だった。後に知り合いに紹介してもらった作品だが、映画館で見ておけばと後悔。意味の分からない説明と早すぎるカット割り。それが良い。そしてマニアにしか分からない自衛隊の役職や兵器など、それがまたマニアでもないのに心揺さぶられる。政府の対応の遅さ、日米における日本の立場、自分を守ろうとする責任感の押し付け合いとたらい回し、官僚の有能さとブラックさ、東日本大震災のオマージュ、政府デモがいかに意味がないか、と色々と感じさせられるところが何回も見て楽しめる。最後のヤシオリ作戦はめちゃくちゃだけどそれが良い。そしてゴジラと共に共存をしていかなくてはいけない人類の課題が残っているのも考えさせられる終わり方だ。個人的にはテンポ感で言うと憲法改正について話し合うシーンと自衛隊の出動のシーンは好き。そして自衛隊統合幕僚長・財前正夫が矢口に言う、「礼には及びません。仕事ですから」はグッとくる。,2022/09/29
5.0,基本、1回見た映画を見返すことはあまりない私が何回も見た映画。数年ぶりに見たが、やっぱり大好きな映画。日本人らしい緻密さ、協調、誇り、プライドを感じる。,2022/09/29
3.8,今の日本がゴジラに対してどんな対応をするのか日本らしさがとても出ていて面白かった！,2022/09/28
4.2,"蒲田,武力行使命令,放射性物質海洋投棄,構造レイヤー解析,デモ,停電,伸びラーメン,コンクリートポンプ車,冷却,人型形成",2022/09/28
3.0,記録ゴジラの第一と第二形態のキモさと、石原さとみの話し方のウザさがすごい映画です。,2022/09/28
4.0,常識破りの化け物ゴジラが現代に登場したらまじでこうなると思う常識的に考えて実行対策が何も意味をなさないって思い知らされる,2022/09/28
0.0,この映画好きで多分5回以上は見てる東京にゴジラが来たらこんな感じか〜〜,2022/09/28
2.5,寝た、、、勧められたから観たが、、わたしがただこの類に面白さを感じられなかっただけだと思いますが…。なんかずっと政府が会議してる。石原さとみで余計に冷める。,2022/09/27
4.4,大作はあまり観ないので、ある意味新鮮。日本の闇と希望を並列で描くあたり。現実のデフォルメと空想のディテールの詰め具合。客に媚びずに大人が真面目に馬鹿になる。面白かった。初IMAXも凄かった。結局劇場には3度向かった。こんなことは初めてだ。背中を押してくれた友人に感謝。,2022/09/27
3.9,まずこれは怪物映画じゃない。ゴジラの皮を被った政治風刺映画。私はポリティカルアパシーぎみのモンスターおたくなのでここはちょっと辛かった。でも言いたいことはわかる。モンスターに焦点を当てれば、ゴジラに形態がいくつもあるのはとても面白い。特に蒲田くんが不気味すぎてインパクト大で、惹きつけられた。無人在来線爆弾もめちゃくちゃ面白い。日本のよくないところとか一旦考えずに、テンポ良くモンスターを楽しみたかったかも。まあこれはこれで面白かったけどね。,2022/09/27
3.6,今までにない新しいゴジラをリアルに表現していたエヴァっぽさもあったし庵野監督の面白さが出ていた,2022/09/27
3.2,戦闘ミッションのときの音楽がエヴァンゲリオンの曲だったのが残念でした。適切かもしれないが、それではゴジラのオリジナリティーが立たない。政府のクソ堅苦し会話が退屈にしてる印象でした。核落とすの？どう？で長々と引延して、一般の弾はノーダメージってのは、これまでのゴジラ映画と一緒ですよね。そこに評価は上がらない映画かな。まぁ、ゴジラの進化形態は少しばかり面白かった程度かな。倒し方はあまり納得がいかないというか、地味でした。,2022/09/26
3.0,ゴジラが東京に現れたら、日本政府はどのように対応するのか。怪獣もの映画というか、社会派映画というか。政府高官たちが右往左往している姿が笑えた。行政対応のシーンは結構リアリティがある感じなのに対し、対策チームによる最後の作戦のくだりは「そんなことでゴジラ倒せる？」と思わせるチープさにうけた。何よりもキャストが豪華。,2022/09/26
5.0,　東京湾に突如現れたゴジラに対して日本政府はどう立ち向かうのかを描いた作品。　　　よく分からない難しい言葉が飛び交う会議シーンがとても多い印象だったが、なんとか会議についていこうと会話に集中するうちに作品にのめり込んでいた笑。日本政府、自衛隊等の各機関の動き(特に意思決定までの流れ)がリアルで面白かった。ゴジラも物語が進むに連れて進化していくのも良かった。特に第一形態なんて本当にゴジラ？と思うくらい気持ち悪かった笑。　また、最後の“ヤシオリ作戦”はまさに総力戦という感じで本当にゴジラを止めれるのかとハラハラドキドキしながら楽しく見れた。,2022/09/24
0.0,やっと観れた！地元が最初にゴジラに襲撃されるって聞かされてたから、なかなか観れずにいた本作さすがの迫力…！チームワーク良くゴジラに立ち向かって行く過程はスカッとした会社で「月曜が憂鬱すぎて、ゴジラが電波破壊してくれてPC使えなくなったらいいのにって毎週思ってます」とか言ってたこと、全力で謝りますゴジラは空想上の生き物だからこそ、ですね,2022/09/24
4.7,石原さとみを起用しなければ完璧だったと俺は個人的に思うよ。電通を恨め。,2022/09/24
5.0,ロマンが詰まりまくってる映画ゴジラのフォルムはもちろん人間サイドもすごくかっこいい。ゴジラ映画ではあるんだけどエヴァの雰囲気があったり…内閣総辞職ビーーーーーム！！！！！！,2022/09/24
4.0,体形が変化することや、エネルギー消費する発想は新鮮だった。日系アメリカ人の役には本当に英語ができる人を使って欲しかったナ,2022/09/24
4.0,古き良き時代のゴジラみたいな音声と、新しい映像が合わさってるから新鮮さと懐かしさを同時に感じる。,2022/09/23
1.5,ここ何年かで1番時間を無駄にしたと思った作品。めちゃくちゃ可愛いけど石原さとみちゃんの芝居が酷い！(笑),2022/09/23
4.0,豪華俳優陣を贅沢に使っている。ゆえに政府の貫禄がすごい。シン・ウルトラマンよりも、サムいノリがなく、ゴジラも派手で面白く見れた。専門用語とかやたら長い役職名とかたくさん出てきたが、理解する必要がないので頭を使わず、なんとなくのノリで見れた。シュールな笑いを誘うシーンもあり、良かった。,2022/09/21
