score,review,date
3.0,ウルトラマンはストーリーくらい知ってるシン・ゴジラは好きな映画というスタンスで鑑賞で、アガるシーンはあるが総評は微妙でした。○怪獣の種類大まかに分けると4回戦うことになります、それを分類すると、脳筋型→知略型→知略型→ラスボスのような流れです、そして作中長いのがこの知略型のパートで、二人の怪獣（星人）は政府を騙してどうにかこうにかという、戦略まで一緒なので、同じ展開を見せられてるのかなと思います。どちらか一つに集約すればいいのにと思いますし、もっと単純に兵器として強いという敵（ラスボスがそうなのかもしれないが、あれはちょっと意味合い違うかなと）がいたほうが絵的にも盛りあがった○人間ドラマ斎藤工と長澤まさみの関係が薄いのに、何故か昔からのバディのような扱いを作中でされているかといって作中でバディとして、この二人の絆が深まるシーンもまるでない大切なものを託したり、相手方に悲劇が起きて泣いたり、関係性から言えば他のメンツの方が信頼にあたいするはずなのに。作中で納得できるだけのドラマを描ける時間がないなら、長澤まさみが転任してきたばかりって設定はせめて外してくれたら、まだ納得がいった。○最後の解決方法のあっさり感シン・ゴジラと比べてしまうが、あれはゴジラを倒すという方法を作中全ての時間で模索した、もちろんそれが手放しで納得できるかわけではないが、少なくても作中でのリアリティは感じられた。しかし、今回はラスボスを倒すために模索するシーン、５分あっただろうか？ちょっと凹んだあとに会議したらアッサリ解決、これなら「頑張れウルトラマーン」と子供に言わせて、奇跡の力で倒したって方がまだスッキリする。他にも、普通は斎藤工の元の性格しっかり描いてから、ウルトラマンと入れ替わりやって、観客に入れ替わってる違和感さとか、不気味さを見せるんじゃねーの？とか思うし、戦闘のCGも予告の鋼の錬金術師よりは頑張ってるけど微妙だなーとか、最初のドリルとの戦闘シーンのカメラワークダサいなとか、「私の嫌いな言葉です」ってのは一回使うから印象的であって二回使うなよとか色々ありますが、全体で音楽は素晴らしいです！BGMやSE両方ともカッコいいなと思います。,2022/11/01
0.0,山本耕史が出てきたらそれだけで楽しく観れちゃうわ。声の出演者を事前に把握しながら観れれば良かった！(一生さん〜)小学校低学年くらいの男の子が親御さんと観にきてたけど、結構難しい説明とかあったと思うから、ちゃんと理解できたかなーと心配になった。,2022/11/01
4.2,おぉ！バランスいい！シン・ゴジラの様な政治ドラマと、ウルトラマンのプロレスが丁度いいあんばいです！個人的には巨人プロレス少なめが嬉しいんですが、VFXのクオリティが高くしっかりしてました。,2022/11/01
5.0,はっきりいって最高である。庵野秀明監督のちょっと後の世代として、昭和のウルトラマン・シリーズに心を奪われて育った三つ子の魂が燃え上がってしまった。これはまさに、すでに使い古されたアイテムに過ぎない「ウルトラマン」を再現したのでは決してなく、私たちの世代がウルトラマンに一番最初に出会った時の「ウルトラマンとの出会いの感動」を、現代にもう一度味わえるように再現してくれたものである。もしも、多くのとても古い作品のリメイク作がそうであるように、当時の魅力的シーンをそのまま現代の映像手法で高品質にだけ描いたとするなら、もちろん、ふつうのオタクは楽しんだとしても、今の私たちの目にはかえって陳腐に見えて、「トホホ」な、がっかりする出来となったことだろう。だから、これはそのような愚はあえて犯さずに、あえて映像手法を高度化しない選択をすることで、「解釈」のほうを高度化することにしたのである。すなわち、今の私たちの知識と理屈に合わせて、設定の解釈のほうを新しくすることで、むしろ、かつてのオリジナル映像自体の評価の地平までも広げてくれた。これができるのは、まさに作品愛が真実極まりない本物の「オタク」だけであろう。たとえば、ウルトラマンの姿や動き、飛び方などを、わざと物理法則を無視した、ヘタなCGそのもの、あるいはまるでプラスチックの玩具のように描くことで、いわゆる「βシステム」の物理法則、ウルトラマンの存在の仕方自体が、私たちの地球の3次元とは違うのだ、と理解させてくれた。女性隊員が巨大化するシーンを、あえて映像的合成のように見えるように再現することで、実際に「合成」のような事態が起こっているのだから、それでよいのだと感じさせ、解釈の次元のほうを逆にはるかに高度なものとさせてくれた。すなわち、これはヘタに科学的なSFなのではなく、もっと本格的に高度に科学的なSFなのだといえよう。まあ、その手法は『シン・ゴジラ』も同じだったのだが、しかし『シン・ゴジラ』はまだリアリティが地に足がついていて、それゆえにふつうの感動はしたが、アクロバット的な感動までは至らなかった。まあ、そもそも怪獣やゴジラ自体に思い入れが少なかったせいもあったかもしれない。しかし、このウルトラマンには、もはや熱狂する以外にない幼少期の思い入れがあり、その思いをこのように納得させてくれた、この新しい「出会い体験」というものが、もはや生涯級に感動が残る素晴らしい出会いだったといわざるを得ない。巷にはいろいろと賛否両論も多いが、それはそういうメタな次元を理解せずに、他の作品と同じ映画と考えて解釈してしまうためであろう。とにかく、私は、ひたすら感動、感謝、感謝である。,2022/11/01
3.6,今までウルトラマンは見たことがなかったが、面白かった。シンゴジラが良すぎたから少し物足りなく感じた。米津玄師の歌はめちゃくちゃこの映画に合ってて良かった。,2022/10/31
3.8,ウルトラマン見たことないけど旦那に連れて行かれた。ちょっとウルトラマン好きにしか理解できない部分多いよね。まあ面白いんだけど。庵野さん作ってて、さぞ楽しかろう。,2022/10/31
3.5,・斎藤工&山本耕史演技良かった。有岡くんも思いの外演技良くて一番応援したくなった！・冗長的なシーンが多くて辛かった。脚本にはまらなかったドラマがない？カタルシスがないような。途中何度か寝ちゃった。原作もこんな感じなのかな？・禍特対もっと掘り下げて欲しかった。あの人たちの活躍やウルトラマンとの連帯感ももっと見たかったし、じゃないといくら神永と同化しているとはいえこんなにウルトラマンに人類愛生まれる？っておもった。早見あかりも西島秀俊ももっと活躍を見たかった・居酒屋シーン良すぎた。メフィラス孤独のグルメやってほしい。好きな言葉です・細部のデザインとかアングルとか、画面の薄暗い色味とか構図はやっぱり良い。これがあるから庵野作品としては楽しい・長澤まさみ好きだから全体的に残念感すごかった、、、,2022/10/31
3.3,公開初日に行ったら「さぁて、樋口サン…お手並み拝見と行きましょうか…！」って顔した特撮おじが沢山詰めかけてて、なかなかの雰囲気だった。語りのひな型がシンゴジラのままだから、人間（特に女）を描く気が全く無いのが伝わってくる。さんざん言われているが、臭いと巨大化パンチラと尻シーンはもちろん好きじゃない。長澤まさみともあろう人が、こんなカリカチュアされた“オンナノヒト”な演出を付けられるなんて、見ていて本当にみじめな気持ちになった。その分怪獣はフェティッシュに描いてて良かった。,2022/10/30
0.0,面白かったけど、どうしてもシン・ゴジラと比べてしまって物足りない感,2022/10/30
2.0,お父さん世代に当時を懐かしんで貰う為に作ったのかな？別に映画じゃなくて新春特番みたいなのでも良かったと思うけど。主役はれる役者達が、子供向けみたいな幼稚な怪獣映画で芝居してるのが滑稽だった。,2022/10/30
4.4,このままだと好きな邦画ベスト3がシン・ゴジラシン・仮面ライダーシン・ウルトラマンになっちゃう…！庵野秀明・樋口真嗣による初代ウルトラマンのリブート作。人類補完計画の成れの果てともいえるウルトラマンが人類に憧れるっていうのは皮肉な話。でも庵野監督が描きたかったのはそういうことなんだろうな。思っていたよりウルトラマン。ウルトラQから始まり、初代マンのエピソード5つほどを繋ぎ合わせたような構成。て感じの内容なので、ウルトラマン、ないしは庵野秀明、樋口真嗣への思い入れがどれだけあるかによって評価が大きく変わってしまう映画になってる。個人的なウルトラマンへの思い入れとしては、小さい頃は「ウルトラ怪獣大事典」だったり「ウルトラ戦士主題歌集」みたいなVHSを何度も繰り返し観ていたし、Qや初代マンやセブン、エースのビデオもレンタルしてきて観ていた記憶がある。世代的にはティガと同い年で、ダイナ、ガイアと続く平成三部作を観てた。(録画とか再放送かな、おそらく。)ソフビやオモチャもいっぱい持ってたし、何よりバンド名に怪獣の名前を付けているぐらいの熱量はある。(ティガに登場する炎魔戦士キリエロイド)庵野秀明への思い入れに関しては言わずもがなだけど、樋口真嗣への思い入れもしっかりある。シン・ゴジラはもちろん、日本特撮史上最高傑作とも名高い平成ガメラ三部作もある。仮面ライダーBLACK SUNのコンセプトビジュアルも彼だし、エヴァやナディアにも関わっている。それぐらい自分の血肉となっている作品たちのDNAが受け継がれていたので、最高だった。とはいえ、メチャクチャ変な映画だとも思う。外連味も凄いし、ターゲット層もよくわからない。途中で急に画質が落ちるシーンがあるし(スマホで撮ってる映像を使ってるらしい)、演技のノリも独特。純粋に素晴らしい映画かと訊かれたら、困ってしまいそう。ウルトラマンにも庵野作品樋口作品にも興味ない人には口が裂けてもオススメできない。いや、シンゴジや平成ガメラみたいなのを期待して観に行ってもガッカリすると思うので、樋口ファンにもオススメできないかも。庵野曰く、もともと三部作(マン→新マン→セブン)を想定して作っているらしいので、是非続編もやってほしい。今作はチグハグ感も目立っているので(シンエヴァ、シン仮面ライダーと同時並行だったので仕方ない部分もあるけど)、次は庵野さん監督でやってほしい。樋口さんは特技監督で。#Showki2022#Showki2022new,2022/10/30
0.0,機内で見た。場面が淡々と切り替わってすごく淡白に見えてしまった。理由はあまりわからない。演技が棒読みに見えたというか、なんというか。あまり気持ちが入っていかない、苦しさとか大変さが伝わってこないなあと思いながら見終わった。楽しかったのは楽しかった,2022/10/30
0.0,賛否両論というのを知ってから見に行った。微妙だったし、そこまで覚えてない…,2022/10/29
3.5,機内でぼーっと観るには、なかなかおもしろかったよ。ウルトラマンの色が変わるのはなぜ？ゼットンがかっこよかった。兵器感。,2022/10/29
3.0,大好きなシン・ゴジラの監督、脚本コンビウルトラマンの知識がなくても楽しくみれました。ただちょっと難しいなと感じました。,2022/10/29
1.2,これほど最後まで見るのが苦痛な映像も珍しい。そもそも、ピコンピコンもジュワッチもないウルトラマン、そんなものは認めない。円谷世代なめんなよ。,2022/10/28
3.8,久々に友達と観に行った映画。令和のウルトラマンを満喫した。CMとか見た感じやったら、えええ、斎藤工がウルトラマンなんかいな。。。という感じやったので、そこまで期待度が高かったわけではなかったんやけど、これはこれでよかったです。山本耕史さんが良かったです。メフィラス星人は令和になると、あんな感じになるんですなぁ。ウルトラマンと並んで一杯やってるところは、なかなかシュールでした。そしてゼットン。令和になると核兵器になってしまうのか。。。ゼットンはウルトラマンを殺してしまえるぐらいの能力があるぐらいのやつやと思っているので、うーん感が否めない。ちゃんとTV版をオマージュしてたんやなって最後に分かってよかったです。,2022/10/28
5.0,今年一番映画館で観れてよかったと心から思った作品。2回しか足を運べなかったのが悔やまれる。斎藤工さんの掴みどころのない不思議ちゃんっぽさが最大限に活かせていて良かった。,2022/10/26
3.0,昭和レトロを現代技術で…って映画音楽もカメラワークも演出も昔のウルトラマンの懐かしい感じが詰まってる。ゼットンがゼットンぽい何かになってたり、随所にエヴァっぽいところがあるんだよなぁ…エヴァ好きな人は嬉しいのかも。山ちゃんはいいけど、どこでも出てくる海馬をそろそろやめてくれんかな…出るなら「ブルーアイズ！」って叫べよ。,2022/10/26
4.2,ウルトラマンティガ世代だけどすごく楽しめた。けどド世代の人とかはもっと堪らなかったんだろうな。実際父親も怪獣それぞれにすごく興奮してたし。あとカメラ位置やCG技術は勿論だけど斎藤工さんや不気味にメビウスを演じる山本耕史さん（特にハマり役だったと思う）など、俳優陣もとても良かった。次回のシン仮面ライダーもすごく期待。池松壮亮さんは縁もある大好きな俳優さんなので。,2022/10/26
4.1,英才教育で受けたウルトラマンの教育のおかげで楽しめましたが、ウルトラマンを知らない方はそこまで楽しめないでしょう。人が大きくなるなるシーンで凄く萎えると思いますが、あれも原作リスペクトです。,2022/10/25
3.5,思ったより良かった。シンゴジラより危機感がなくて、ハラハラしないけど、そりゃ禍威獣の出現が当たり前になってきてしまった日本で、禍特対が何とかしてくれるってみんな思ってるから民間人も、お役所も、お上も我関せず。死んだらそこまで、考えても仕方ないっていう一種の諦めが集合概念が生まれてて、頑張ってるウルトラマンの戦いと、丁度いいアンバランスさ。それよか世界中、他国への体裁と金、金、金。そりゃ繁栄するに値しないって言われてゼットン仕込まれる。,2022/10/25
3.1,初代マンとセブンを観て育ち、思春期にはエヴァにどハマりし、シン・ゴジラは3回観に行った人間だが、シン・ウルトラマンの出来には納得がいかなかった。禍特対が巨災対に比べて魅力なさすぎる。全体的に人物が描けてなさ過ぎて、メフィラスが異常に輝いて見えた。山本耕史の貢献はデカい。,2022/10/25
5.0,THE・人間賛歌！「人間は自分たちが生きている星の環境を破壊する愚かな生き物」という外星人の言葉で始まったはずが、最後には外星人であるウルトラマンが自らを犠牲に人間を助ける。それは、人間が他人のために自己犠牲を厭わない素晴らしい生物だから。これらに関しては明確に言葉として示されることはないが、行動で示されるのが良い。何でもかんでも説明すれば良いというものではないだろう。それに言葉よりも行動の方が、より信念や強い思いを感じることが出来てウルトラマンの良さが伝わった。あとは庵野秀明独特のカメラワークも良かった。そして、あえてのキャラクター性をゴリ押しや特撮っぽい話口調など、好みが別れるとは思うが私は好きでした。まあ好き嫌いがハッキリ別れる作品だとは思いますが、私は好きです！,2022/10/24
3.0,カトクタイの人たちが話してる時のカメラワークがめちゃめちゃ好きだった！,2022/10/24
4.0,そう来たか、まさかのゾフィ、ゼットン、、、長澤さんの使い方もトラウマです。,2022/10/24
4.0,普通に面白かった。話題となっている主題歌への造詣の深さについては、原作をあまり知らないので（原作への愛が足りないので）あまりピンとこなかったのが正直なところだが、雰囲気や空気感はとても良かった。,2022/10/23
3.3,ウルトラマンも結構人間臭い、というか思考に取り憑かれる生き物なんやなーと知れて面白かった。浅見がウルトラマン初めて観たときにあれがウルトラマン、、、美しい。って言った時ホンマそれ。って思った。CGの観点でMCUと比べる人多いけどそれはナンセンスな気がする。会議のシーン、カット回しとか庵野感あったけどなんか実写ではあんまハマってないっていうか、、、山本康二のメフィラス星人の存在が良すぎた。,2022/10/23
3.3,前半は面白かったけど、個人的には後半はちょっと追いつけなかった、、,2022/10/22
4.5,非常に良かった。子供の頃の夢がウルトラマンというのを思い出しました,2022/10/22
3.6,"シンゴジラのせいで期待値を上げすぎてしまったな‥とつくづく思ってしまった者です。シンゴジラを劇場で見ている時、これが一体どんな結末になるのかなんて全く判らないような、そんなワクワクな気持ちにさせてくれたのがあの""新""ゴジラだったわけですが‥このシンウルトラマンの蓋を開けてみると、いわゆる総集編的なやり方で‥つまりもう知ってるやつをもう一回現代風に再解釈してやるというものでした。ただ、アレンジしたりそのままにしたりする部分は存在していて、一応ファンとしてはその違い楽しみはしましたけど‥そのアレンジした部分というのがあるわけですが、例えば主人公シンジのキャラが「地球が静止する日」のキアヌリーヴスの役にしか見えなくてイマイチ新鮮味に欠けるなぁ‥とかどうも無難な感じの印象が拭えない収まり方をした印象でした。山本耕史の演技など良い部分も有りはしましたが。映画を見る前、もしこの映画が微妙な出来だとしたらどんな内容だろうと想像してたんですが、「ウルトラマンパワードに毛が生えた出来栄えぐらい」なんじゃないかって勝手に想像してました（笑）結果的には「ウルトラマンに毛が生えた程度」でした。ただそんなに外してもいなかったのもあってか、あまり期待しない様に見た筈なんですが、「期待しすぎたな‥」なんて思ってしまいました。",2022/10/22
0.0,面白かったけど別に配信で観ても変わらなかったかなという感じでございました,2022/10/22
2.2,まず禍威獣ってネーミングセンスがダサい。普通に怪獣でいい。闘いのシーンももCG感が強くちゃんと特撮でやってもらいたかったところ。樋口監督は重量感のある特撮が得意だと思ったのに。あとシン・ゴジラではあった怪獣の市民への脅威みたいのも希薄。ザラブ星人のにせウルトラマンを持ってくるあたりマニアックではあるけど作り的にはTVシリーズの映画版のようなオムニバス的な感じであっさりしている。そもそもウルトラマンも地球人と融合体にならなければゾフィーと同じ考えになったのでは？と考えるとオリジナルとは違い光の国では異端な存在になる。敵対するゼットンの造形と位置付けもちょっと期待外れ。良かったのは山本耕史の異星人感かな？実相寺的なアングルを狙ってかローアングルからの見上げを多用しているけど長澤まさみと早見あかりの丸い下顎が目立ってちょっと可哀想。女優さんはキレイに撮ってあげて欲しい。,2022/10/21
5.0,だいぶ前にはなりましたが映画館で見た時は鳥肌が凄かったです！かっこよすぎて！当時のは全然世代じゃないし、世代はメビウスですが、ウルトラマンはやっぱりこうです！CGを使っても色褪せないかっこよさ！凄いです！よくストーリー面で批判されてるのをみますが、あの時代を思い出させるようなポンポンとした展開でとても好みです！,2022/10/21
4.0,素直に面白かったです。ゼットンの絶望感とか表現が上手いと思いました。,2022/10/21
3.6,カメラワークが流星課長を彷彿とさせてきたな俺もまだ若者の類だけどもっと若い世代はこれを観てエヴァじゃんって思うのかな,2022/10/21
3.0,ウルトラマンはあまり見たことなく、あらすじも読まずに見たが、思っていたのと違った、というのが感想。激しいアクションの戦いは少しだけ、後は外星人のやりとりや心理戦が続いていた。カメラワークも見にくかったがオマージュでは無いとか。,2022/10/20
3.5,物腰柔らかい底抜けの悪を感じる山本耕史が、人間味のない正義の斎藤工との対比で際立ってた。1番ハマり役。あと実相寺アングル本当に多用してて、そういうものとして観たら面白かった。,2022/10/20
3.5,シンゴジラは観ましたが、エヴァンゲリオンシリーズと初代ウルトラマンは未鑑賞です。巨大な銀色の宇宙人が怪獣や外星人相手に戦うシーンはどれも良かったです。特にザラブ星人との空中戦からのスペシュウム光線は素晴らしかったです。ですが人間周りの描写には飲み込めないことが多々あり、神永新二がウルトラマンと入れ替わったのに気づかない禍特対の面々、そんな禍特対をウルトラマンか好きになる展開があったか、長澤まさみあたり全部等々は疑問に思いました。山本耕史のメフィラスはとてもよく、真面目なウルトラマンと飄々としたメフィラスの会話はもうずっと居酒屋で飲んでて欲しいと思いました。,2022/10/20
3.3,シンゴジラは誰にでも勧められるけど、この映画はかなりマニア向けで微妙でした。山本耕史は最高！,2022/10/19
4.2,記録漏れ。ティガを幼少期に見てたくらいだけど、面白かった。最初から最後までウルトラマンさんがかっこよすぎでした。,2022/10/19
