score,review,date
5.0,こんな素晴らしい映画を今の今まで観ていなかったなんて。ゴアシーンがゴリゴリだけどスタイリッシュなのでゲーム感覚で楽しめる。恐怖と緊張感の気持ちよさがたまらない。ゲラゲラ笑える。人間ってここまでされても死なないもんなのね。勉強になりました。ストーリーが無なのが潔くていい。傑作だった。あとハゲオヤジかっけえ。,2022/10/18
3.2,適度なグロさとピエロの理不尽さが素晴らしいけれども殺すときがワンパターンすぎて飽きてくる。できればもう少しエロスがほしい。ジャンプスケアからの殺人が多すぎて、もうええて！ってなってしまった。失神したり嘔吐したりした人がいたとTwitterで話題になっていたから2は映画館で見ようと思う。,2022/10/18
3.3,全米で恐怖と不快感の【貰いゲロ】映画として絶賛大炎上中の最新作のおさらいをU-NEXTで。特殊メイクやCGは安っぽいものの芸術的なスプラッター描写、創造性のある死体損壊法、何より一言も喋らない・見上げたプロ根性の白塗りピエロの不気味さがお見事。(【ペニワイ】や【ジグソウ】は見習いなはれ)倒錯的なエロよりも変態的なグロを優先してる武闘派タイプ。ただ不死身はもちろん、いただけないしルールや由来が無いデスゲームは飽きが早い。ストーリーが完成する前に思いつきでショッキングな凶行をねじ込んで無理やりラストまで持ち込んだようなパワープレイはまさにB級。冒頭のシーンは「悪魔は伝染する(？)」的な伏線なのかな。途中の「全裸ドッキリ」も気になります。とりあえず悪趣味で救いようがないほど低級なので『2』から観始めてもよさそうですね。,2022/10/18
3.0,《夜道を1人で歩く時こいつの仮装します》怖さもグロさもちょうどいい💭本当に人の体って片手ノコギリで半分にできるのだろうか？！あとお前は不死身か！,2022/10/18
3.2,存在は知っていたけどピエロがキモすぎてなかなか観る気になれなかった。続編が出るらしいので鑑賞したがとにかくグロい。ホラー映画あるあるのイライラするシーンが多め,2022/10/18
3.2,なかなか楽しめた。くだらない前置きや本筋と関係ない人間ドラマとか省いて見たいものを見せてくれた感じ。まさに「こういうのでいいんだよ」定食。お化け屋敷に近い感覚とでもいえばいいのか、怖さやドキドキだけ欲しいって人向け。ホラーモノによくあるけど「頭が悪いと死ぬんだな」が実践されててよかった。殺人鬼も人間でミスがあったり、隙があったりするのだけどまるで活かせてない犠牲者。殴り倒しても回復するまで待ったり、止めを刺さずに助けを求めて結果殺されるというホラーの王道。毎回この法則でイライラするのだがやっぱりアメリカ人はアホ。今回のピエロは異常者だけど複雑な背景がありそう。声を全く出さないところから声帯がないのかも。それは拷問や虐待の過去を考えさせる。ここまで異常者だとそうした精神的なトラウマで歪んだと容易に想像がつく。でもアメリカでは日常的に異常者がフラフラ出てくるので、こうしたB級ホラーでも日本人よりよりリアルに感じるのかも。最後の復活は笑っちゃったけどジェイソンやフレディのように「恐怖のアイコン」を作りたいのか？ピエロ（クラウン）はアメリカのっ子供にとって恐怖の対象となるのが面白い。日本ではない現象だけど、文化背景の違いから恐怖を感じるというのは実に興味深い。,2022/10/18
2.4,クソグロいななんじゃこりゃ。とりまタラが可愛すぎた。これに関してはストーリーもクソもないよね,2022/10/18
4.0,ホラー映画はだいたい主人公が生き残るものだと思うんだけど、この話は少し違った。え、死んじゃったよ、、こっちが本命？？ってなった第2弾が公開されるそうなので、楽しみ。,2022/10/18
4.2,”アートなピエロ”ヤバかった！笑ゴア描写も気合い入っててめちゃ良かった！2も楽しみ^ ^90分ホラー最高♪,2022/10/18
2.7,主人公と思ってた人がそうじゃなかったり、サビてるノコギリの切れ味が良すぎたり、途中出てくる人形抱いた人のメンタルがおかしかったり、逃げ込んだ建物が汚すぎるし、何の建物かよくわからんなどツッコミ所が多すぎてゲンナリ。,2022/10/18
3.6,グッグロい､､､エッエグい､､､話しのスジなんぞない。通りすがりのピエロ🤡に只々、殺されまくる遠慮も躊躇もなんもない。ラストに1人くらいは生き残るのがお約束だけど、いゃ〜何だかなぁ〜死体の感じが、こないだまで、テレビでやってた赤いナースコールと似ておる。もちろん、赤いがパクリだと思うけど画面が暗い分、こちらのが驚く🥶,2022/10/18
3.2,無敵設定の敵は好きじゃないちゃんと死ぬ相手で最狂なのがいいいうてもB級だからクオリティが高いとはいいつつ作り物とわかる感じでした時代が進んでグロテスクのレベルあがっていったら見れなくなってくるんだろうなぁ,2022/10/18
4.0,面白かった。ものすごく昔の映画のような気がした。続編映画館行くか迷うなー。,2022/10/18
2.9,ドーンが二つに裂かれるシーン、グロイ、犯人ピエロは執拗に相手の顔を潰す。食べる。殺しても死なない。　人間じゃないのか？ハロウィン🎃にあんなピエロが現れたら⁉️とにかく最後までエゲツナイ、キモイムービー😵,2022/10/18
2.6,2が吐くほどグロいと話題みたいだから観てみた。キモいピエロが無意味に人を殺していくんだけど、ホラーにはよくある王道のグロさ。襲った被害者にわりと抵抗されて刺されたりしてるのにすぐ元気になるwwなぜ不死身設定なのかが謎、、,2022/10/18
2.7,テリファー2が話題になってて久しぶりにスプラッター観たけど、グロいがツッコミ所は満載…好きな人は好きなのかなぁ…昔は好きだったけど歳とった今はお腹いっぱい…,2022/10/18
3.2,ピエロの造形と演技はすごく良い。グロいはずだけど、半分くらいコメディになってる気がする。,2022/10/18
3.0,うーん、グロいね。これはちゃんとグロい。これの2がやばいってことでこっち観ようかとして鑑賞したけど、こりゃグロい。まぁ1部だけだったけどね。内容は至って単純。狂ったピエロに追われる以上。いや、まじピエロ一言も喋らんし、背景とかなーんもないから、サイコパスが居る。やべーぞこれは！って映画でしかない。まぁその辺どうでも良いのかもしれんが。まぁまぁ楽しめた！これでグロだけが増すなら…観たくないかな。痛いの苦手なので。。。笑哭悲的なゴア追加くらいならおけ！笑いや、お股グリグリヤバいそれ見てるあいつちびらんのすごいにしてもおいおい、今やっとけよ？とゆーシーンが多すぎて笑っちゃう。俺なら○すね！(無理な気がする),2022/10/18
0.0,スプラッターに全フリした映画！ストーリーとか全然ないよ、とにかくノコギリぎこぎこ,2022/10/18
2.5,なんか色々物足りない特別面白くもなかったしピエロのビジュが良い(怖すぎ)だけに残念,2022/10/18
3.0,記録スプラッター映画だけど、何だかピエロ面白くて笑っちゃった。続編はもう少しグロいのを希望。,2022/10/18
0.0,ハロウィンの夜に白黒ピエロが惨殺🤡あのビジュアルはなかなか。なにが目的かよくわからないところもキモ怖くて良。お股ギコギコはいたたーとなったけど、刃が進むにつれこれは無理だろと現実感がなくなってちょうどいい塩梅だった。生皮やらパフパフやら面白くなってくる顔はホラーに寄りすぎてあれで退院はないだろと笑,2022/10/18
2.0,殺人鬼が理由もなくとにかく殺しまくるだけのグロ映画。自分は「もしかしたら助かるんじゃ……？」って希望を徹底的に踏みにじられてからエグく殺される作品の方が好きだから、この映画はあまり合わなかったかな。わざわざポップコーンとコーラ用意して真面目に観る作品じゃないと思う。でも二枚おろしとか首ギコのシーンは結構衝撃度強いし、登場人物の身体の耐久性はマショマロ並に弱いから、ギャグスプラッターとして観るならかなりオススメな作品。,2022/10/18
2.5,ピエロのデザインが破壊的に気持ち悪いナイフで人刺しだったり逃げる人間がちょっとずつ反撃するところにいちいちもやっとした不死身なやつだからもっと反撃されてるとこ見たかったな,2022/10/18
3.3,こ、これは、、、、、股裂きのところやばすぎって思ったけどなんかもうやばすぎて別になんとも思わず見れました。ストーリーなんてあってないようなもんです。2はどうなるのか非常に楽しみ、、、、、哭悲、屋敷女まではいかずとも、十分なグロホラーでしたね😌,2022/10/18
0.0,狂気の無口ピエロ詰めが甘いのが気になるけどまた割ノコギリ痺れる,2022/10/18
1.1,見なければ良かったと思うくらい自分にとって面白い要素がなかった。怖いというより悪趣味という感じ。ピエロのメイク鼻がチョン、で元々の骨格活かしのタイプ。『IT』とどっちが怖いか見比べるなどした。『IT』の方が怖がらせようとしているから、実際遭遇したら今作の方が怖いかも。コントラスト強めの映像は怖さを薄めるし、目にうるさかった。,2022/10/18
3.5,続編が結構ヤバいとの噂を小耳に挟んだので、どんなもんかと思い鑑賞。た、確かになかなかゴアがキツい！全体的にテンポが悪いし登場人物の視野狭すぎだし耳悪すぎなんだけど、まぁそういうとこはどうでもよろしい。,2022/10/18
0.0,2が話題なので観てみた。途中まで吹替で観てたら、逃げる女子の息遣いが下手なAV女優の喘ぎ声みたいでイラついて字幕に切り替え。好きな人にはいいんだろうなぁと思い。やっぱりホラーとエロスは近いところにある。エログロ。内容がないのはいいとして、ピエロのキャラは見た目と残虐行為だけしか写らなくて、性格とか理由とかがないのが残念。意味不明にそういうことするから怖いのかもだけど、ある一定の殺し方とかこだわりとかがあった方がもっと好き。映画の殺人鬼って美学があって、その人なりの美学に基づいて殺戮している映画は名作になっているんじゃないかと思った。見た目もね。このピエロは見た目がわたしの好みじゃなかった。逆にITとかこわいけど美しいピエロで良く出来てたなぁと。超グロ死体とツーショ撮るとことか、ちょっとだけお茶目さが見え隠れしていたところはある。2でさらにキャラが立ってますように。,2022/10/18
0.0,おおっ…てなるシーンがあってびっくりあんなのがカフェに居たらこわいよ、、,2022/10/18
4.0,特に語るべきことは無いです。不気味な人が登場してその不気味な容貌から想像する通りの怖ろしい行動をしていくという映画,2022/10/18
0.0,残虐物が好きな人におすすめ特にストーリー製はない。ただただ殺人ピエロが人を虐殺していく。グロすぎるのが苦手な人は観覧注意#ホラー,2022/10/18
2.9,救いが一切ねえ(；∀；)冒頭の女性コンビのアホな方がアホすぎてイラつくのと、もう片方も中盤で反旗を翻すも油断したせいで撃たれて死んだり(しかも死ぬまでが長い)と、登場人物の不甲斐なさが目立っていたように思う。アホ女の逆さ吊りノコギリ見せつけシーンと、メンヘラ母親の髪と胸を剥いで変装していたところはサイコ感あって良し。,2022/10/18
3.8,無駄のないホラー映画脚本に逃げないでお約束をきちんと守る魅力的なモンスターがただ人を襲うだけで充分楽しめる作品に仕上がっていることが嬉しかった,2022/10/18
3.5,レビューにもあるように話題になってるので鑑賞。そして同じくつい何分前とかにレビューしてる人が多くて、同じ時間に同じ映画見てた人がたくさんいるって考えるとなんか面白いwグロ耐性ある方やと思ってたけど、これはなかなかでした、、、最初のシーンなんであの女性笑ってたんやろ？生き残ったけど精神的におかしくなったんかな？,2022/10/18
3.7,ド派手なゴア描写に特化した一点突破スタイルは非常に良かった👍古いイタリアンホラー的な映像の質感もマッチしてたし、理不尽な暴力と恐怖を描くのに殺人ピエロの出自とか細かく説明する必要もないよね。そのあたりも潔いと思う。続編にも期待してます,2022/10/18
3.7,秋の夜中に強烈なやつ。2作目が米で公開したら失神&嘔吐者続出との事で、気になってたけど観てなかった本作を鑑賞。ヤバい。グロい。キモい。エグい。マジ怖い。なんかホステルとかか、忘れたけど、久しぶりにそれ系のえげつないホラー観た。次に殺される、生殺しにされる心境がこれほど解る映画ってあったかな。。もう気分はハロウィンを超えてもうた。。,2022/10/18
0.0,2が失神したり嘔吐したりする人がいると記事で話題になっていたので寝る前に1作目を視聴ピエロ刺しても殴っても立ち上がってくるから不死身なのか‥痛がってるのはパフォーマンス？てか人間じゃなないのかよって感じだったピエロのバックボーンがあるなら知りたかった。,2022/10/18
4.0,おもしろかった。このピエロのフィギュアが欲しいです。最後なんで生きてたのか謎。,2022/10/18
3.0,ストレス溜まったらホラー映画を観るに限る！だって何も考えず、90分間ハラハラとドキドキを感じられるのだから。最近もやもやした事があったけど、これでスッキリ。.残虐で容赦ない殺人をしっかりと映像として流すのでゴア描写の耐性無いと直視出来ないだろうな。目的も犯人の背景も分からないままストーリーが進んでいく感じが良い。終始不気味で掴めない。色んなバリエーションを使ってどんどん人がピエロに殺されていく。続編はもっとパワーアップしてアメリカでは鑑賞者が嘔吐してしまったレベルらしいので期待値高まる。,2022/10/18
3.0,思ったより古いスプラッター映画を見てるみたいでそこまで怖くなかった。2に期待したい,2022/10/18
3.0,1時間弱で短めなのでサクッと見れるのがいいですね、2が日本で上映されることを願います,2022/10/18
4.0,現在海外で上映してる続編で鑑賞中に失神や嘔吐する人が続出してるらしいので気になって前作を冒頭の人は姉ちゃんか‼︎ただ迎えに行っただけなのに‥一言も喋らないのに表情豊かなクラウン,2022/10/18
4.0,なにが良かったってアートザクラウンがわりとしっかり被弾するところ。雷電もチビりそうな高周波ブレード顔負けの糸鋸で人をぶった切り、蹴りでオヤジの顔面を破壊する高火力キャラなのに、自分が刺されると結構ガッツリ痛がるのがいい(効いてるとは言っていない)そのおかげで、「こいつわんちゃん殺れるのでは？」と期待を持って見られるので、より「死闘感」が高まる。タラちゃんが「はやく立つです～かかってこいです～」とアートザクラウンに謎の煽りを入れるシーンはテンション爆上がりで、拳を高く突き上げてしまった。更に死闘感を助長するホラー映画らしからぬエレクトロニックにも心が踊った。ゴア表現にも愛を感じる。手作り感のある、お母さんの卵焼き系グロなので、そんなに身構える必要はない。切断の方法は違えど、女性器欠損系の描写であれば、ラース・フォン・トリアーの『アンチクライスト』のほうが1000倍痛い。それでも隣で見てたトイプーは異様に欠伸をして吐きそうになってたけど。特に表立ったコメディ要素はないけれど、アートザクラウンの他に謎の気狂いおばさんが出てきて、おかしな2人が心を重ねていたり、そういう映画の作りその物にシュールなコメディの香りを感じる。じわじわ笑える。刺された後中指立てて怒ってるアートザクラウン、好きすぎるな。,2022/10/18
0.0,まだ途中やけどマジでみらんきゃよかったほんとに一番グロい最後まで見た今まで見た映画で一番怖かったけどグロいだけすぎて嫌い,2022/10/18
4.0,良かった！スラッシャー系で描写もいちいち人が嫌だなと思うような焦らしだったり凄くうまい！全く喋らないピエロも不気味さが増しててファニーなのに怖い！めっちゃ好き,2022/10/18
3.3,ずっと気になってたけど観てなくて、話題になってるのを機に鑑賞。殺人ピエロが結局何者かわからないのが良かった。最後の最後までただのやばい奴っていう情報しかなくて、余計なことを考えずに観れた。,2022/10/17
3.7,スプラッター系に分類されるホラー。こういうホラーなぜか気になっちゃう性格で見てみました。悪魔のいけにえと雰囲気は似ていました。ただ無表情か笑顔、人間かと疑うくらいの不死身、サイコパスなど考えてこっちの方がキツかったです。マジで1990年くらいの映画かなって思ってたら2016年でめっちゃ最近でした笑日本ではグロいからかわかりませんが公開されなかったらしいです、、、アメリカではテリファー2が最近公開されたらしく上映中に失神や嘔吐する人もいるらしいです。こう考えるとまた2もアマプラで配信されるのを待つしか無さそうです笑#fantail2022鑑賞,2022/10/17
3.4,久々に目を逸らした。グロは作り物感満載でしたがピエロの動きが不気味でよかったです！,2022/10/17
3.3,とにかく残虐性が光る。70～80年代ホラーを思わせる色調のB級ホラー。ピエロが何者なのか、目的は何なのか、ということは一切描かれない。説明くさいこと一切なしで、目を背けたくなる映像だけで勝負した作品。逆さで宙吊りの役の人、辛かっただろうなぁ。,2022/10/17
3.8,これですよ！これ！！80'sスラッシャームービー感ある映像、ストーリー、グロさ気持ち悪いピエロ最高ですよ！グロキモムービーですのでせっかくならポップコーン片手に楽しみましょう。,2022/10/17
3.1,ベタベタなホラー。全部の扉に鍵かかってて、至る所に武器が落ちてる。序盤はベタでも悪くなかったけど、流石に同じ展開の連続だから後半は飽きてしまう。,2022/10/17
3.7,夜遊びの途中で殺人ピエロに見初められた若い女たちが逃げ惑う。見せ場は多いが大味な演出でB級の域を出ない。顔面破壊をはじめ刺激は強いものの血糊のおかげでマイルドになっている。,2022/10/17
2.8,なにやら今、テリファー2が話題のようです。この作品知らなかったけど最初のテリファー観てみました。あのITとは違うピエロ🤡がまぁ不気味な事！前振り一切無く理由もない殺戮がどんどん進みます🤣スプラッター、その描写も凄いのだが慣れてしまったのだろうか…80年代のそのおどろきはなかったなぁでも2もきっと見るでしょう。ピエロ見たさに🤡,2022/10/17
2.3,ピエロがひたすら人を殺害する映画。人を殺す動機や、なぜピエロの格好なのか等のバックボーンが全く語られぬまま話が展開するので、後半は飽きてしまう展開。殺害シーンはグロいですが作り物感満載なのでそこまで印象的ではなかった。。無口で、表情が分からないのは不気味でした。。,2022/10/17
2.5,良いとこ・ピエロの不気味さがすごい気になるとこ・股裂はグロすぎ・お姉さん最後外出れたのにまた建物の中に逃げ込むの意味不明すぎるホステル、グリーンインフェルノに並ぶレベルで人にお勧めできない映画,2022/10/17
3.2,今年見た中で残酷なグロホラー。わかりやすいくらいにヤバいピエロの殺人無双。,2022/10/17
3.4,最近話題のやつですね。ホラーは見慣れてきましたが、スプラッタージャンルはどうもまだ慣れない…はぁ疲れた…(￣▽￣;)これでもだいぶエンタメでした。胸糞系では…ない…かな。,2022/10/17
4.0,そういえば見てなかったテリファー。怖いとかグロいとかはもうどうでもいいんだけど、このピエロ、ラストまでひたすら飽きさせない。殺人鬼というよりエンタテイナー。かなりカリスマ性ある。え、めっちゃ好き。すっかりファンですわ。こーれは2も楽しみんごねぇ,2022/10/17
3.0,2が凄いって言うんで気になってたテリファー。ちょっとグロ痛いので再生速度上げて観てしまいました。ごめんなさい。女の子が隠れながらクラウンから逃げるシーンが全体の半分くらいで多少飽きた。クラウンのキャラデザと動きは可愛いし超キモイ。やる事もキモイ。メアリーのお母さんにバブってるところ可愛かった。,2022/10/17
3.6,２が映画館で失神、嘔吐するって噂で鑑賞。B級なのにA級レベル笑とりあえずグロすぎるのと、今まで見たピエロの中で一番サイコパスすぎて頭おかしなる。笑飯食いながら唯一観れなかったー,2022/10/17
3.0,いや〜膣から真っ二つにいかれるの痛そうすぎる。funnyなピエロがシンプルに残虐なのでわかりやすくてちょうどいいです。,2022/10/17
3.0,ピエロ人間じゃないのね？死なないのね？逃げる方も爪が甘くてちょっとイラっとするー😱,2022/10/17
3.0,深夜の寝る前に見てちょうどよかったです。幼少期だったら確実トラウマなビジュアル,2022/10/17
2.9,せっかくピエロのキャラが立ってるんだから、殺人の背景とかピエロの過去とか知りたかった,2022/10/17
2.0,テリファーってそういう意味なのね。今まで見た映画の中でかなり直球な映画だと感じました。ピエロは人間なのかオカルトなのかよく分からず、不死身とわかると途端に冷めてしまいました（ ;  ; ）コントラストと明度が強すぎて血糊感がすごく感じてしまい、スラッシャーシーンのほとんどは「塗りたくってるなー」の一言。それでも体分断のシーンは流石に目を逸らしたくなったです(^_^;)キャラクターとしてはとても気に入ってました。空っぽのピエロに少しでも人間性を感じられたのならドラマも生まれたのかなと思いました。人形の母親とそれっぽいシーンになってたけど、そもそもどっちもイカれているから成立してないよね。普通ってなんだっけ笑次を見るかは悩むところ(＞人＜;)#レンタル#スラッシャー#グロ,2022/10/17
