score,review,date
3.2,2がどうやら話題って記事を見かけてなんとなく気になり人生初のスプラッター映画（よね？）。スプラッターものぅてストーリーがなくてただただグロいだけの印象だったので今まで触れて来なかったけど思ってたよりは、思ってたよりはストーリーあった…あった…？のと、いやなんでやねんどういうことやねん的な気になるポイントがありすぎて恐怖から気が逸れたので観れた。でもやはり好きではない。2は劇場で男性がreverseしたとかしないとか。観ない。,2022/11/03
0.0,ハロウィンやからホラー映画一本。もう無茶苦茶！たしかにグロいけど痛いって感じのグロさではなかったかな。なんかストーリーはほぼ無いし、最後もなんじゃそりゃって感じやけど、ホラーやから全然なんでもありやわ！！ホラーやから！！ピエロのビジュアルは最高やし、冒頭からエンディングまで一切喋らん感じも良かった。ぐらいしか感想ないかな。B級ホラーやのに、2時間超えてて、グロすぎると噂の2がすごい楽しみです。,2022/11/03
2.8,スプラッターシーンは相当ですが、内容が無さすぎて、、映画として見るのはあまり面白いとは思いません。。。ですが。2、楽しみです。,2022/11/03
0.0,茶目っ気出してくる殺人ピエロの造形は不気味でいいんだけど、ゴア描写が下品すぎてレザーフェイスやジェイソンの様なカリスマ性が感じられないのが惜しいところ。殺人鬼が銃使っちゃアカン,2022/11/03
3.0,2が話題になってたので。とにかくグチャグチャのドロドロのスプラッター。気持ち悪いが怖くはない。そしてストーリーも全くないので、大して面白くもないが、ラスト急にファンタジー。横になって観てたからウトウトしちゃったわ。残虐に殺すのが好きなのかと思ったのに、反撃されたら銃でアッサリ殺すとかポリシーないなぁ。あと、チェンソーならともかく、手動ノコギリであんなサクサク切れるかね？ピエロが華奢すぎて割とスタイル良いのは笑ったwひたすらゴア描写が見たい人向け、ザ・B級ホラー ！,2022/11/03
3.0,何を考えてるか全く分からない所がめちゃ気持ち悪くて良かった。ビジュアルも結構良い。内容がなさすぎて、ショートフィルムぐらいが丁度良いんじゃないかと思った。,2022/11/03
3.2,ハロウィンの日にポップコーン片手に見たかったグロいけど、何故か笑っちゃうでも、やっぱりキモい〜(笑)次回作は上陸したら見たいけど、映画館では見れないかも,2022/11/03
0.0,吐き気するって言われてるやつ、ほんとに吐き気した、、、2見たいけど見たくないなあ,2022/11/03
3.5,テリファー2が話題だったので気になり1作目を鑑賞。ストーリーは至ってシンプルで、ピエロの姿をした殺人鬼が人々を残虐に殺しまくる映画。ノコギリで人体を切断するシーンがあると聞いていましたが、まさか「その方向」とは思わなかった…ピエロが全身白いので血飛沫が目立って映えます。話しかけても無言で、ときおり滑稽なリアクションをとるピエロがとにかく不気味。グロ描写は強めなのでスプラッターが苦手な方はきついかと。逆にスプラッターが好きな方は様々な殺人・グロ描写があるので一見の価値はあるかと。時間もこのくらいだとちょうどいいですね。ジェイソン、フレディ、ブギーマンなどに続く新たな殺人鬼キャラが生まれたかもしれません。,2022/11/03
0.0,アメリカで話題の続編の前作。確かにグロいけどなんせ造形？がちゃっちいからリアルじゃないから微妙なグロさ。続編は、ゲロ吐く人や失神者が続出してるみたいだけど予算があがってちゃっちさがなくなったのか？このレベルならこんな事には・・・。ピエロの無気味さわ最高！ゲインみたいに殺した女の皮膚を着るユーモアは良い！バッドエンドも最高！救いはなくていいよ〜。,2022/11/03
2.4,話題になってたから期待して見たんだけどめちゃくちゃ期待裏切ってくるじゃん。ただの変質者ピエロだし、美乳が似合うくらいお腹キレイなのめっちゃ気になるし、逆さまに吊り下げられたらおっぱいそんな形になるんだっていうのしか入ってこなかったよ。,2022/11/03
3.5,・2022/11/03・Amazon prime video股ギコギコ最高すぎて爆笑しちゃったよ🤣なかなかすごいって聞いてたけどこりゃすげーや🤣🙏🏻ラストも後味悪いのか…と思ってたらそうじゃなくて良かった🥹w次作も上陸待ちだっけ？楽しみჱ̒(ᵒ̴̶̷᷄‎ ᵒ̴̶̷᷄),2022/11/03
2.0,朝イチから予定があったのでいっそ徹夜したろ！と思って見たけどまあつまらない。スマホがある時代に作られたとは思えない稚拙なグロ表現、老若男女誰もが先読みできる陳腐なストーリー続編が話題だけど一作目がこれだと見る気失せる何よりつまらないせいで危うく寝過ごすとこだった,2022/11/03
2.7,2が公開されたので1がどんなもんか観てみたが…。はっきり言って面白く無いホラー作品でも脚本は重要だと思うがただ殺していくだけグロいだけのチープな作品だった高評価してる人達は何が良くてしているのか理解不明😂グロ描写位しか印象残らない中身がスカスカの作品スラッシャー系で逃げるタイプでは無く飛んで火に入る夏の虫タイプ脚本は有って無い様な感じスラッシャーが待っている所にひとり一人やって来ては殺される登場人物達は一応にマヌケばかりで終始イライラする通報する前に早く逃げれば良いのにのらりくらりしてるから観てる間のストレス半端ないグロホラーが好きな人にしかススメられない駄作2はこの次観ようと思ってるが大丈夫か？(^_^;)※2022 /11 /04付け2を観たこちらは面白かった　2時間超えの作品になっていた今作よりスケールアップしていてグロ描写多めヒロインの（可愛い）主人公が居てストーリーもちゃんと有る今作はオススメ出来ないけど2はオススメ👍興味の有る人は1と2を観比べて欲しい,2022/11/03
3.0,おもしろくないなんか2が話題らしいので見たけど、個人的にはイマイチだった。他の人のレビューは悪くなさそうだから個人的にハマらなかっただけなのか。怖さはほぼない。スプラッタ演出に古典ホラーへの憧れは感じる。（リスペクトとは思わん）びっくりシーンが多いが質が低い。ストーリー性がとにかく薄い。導入は面白そうだと思ったけど、中身なくて結局ピエロ暴れただけだった。最初の顔のない女性が番組の司会者を襲うシーンも絶対いらないし、ストーリーが薄味すぎたので少しでもミスリードを誘うために慌ててつけたようにしか見えん。グロシーンはところどころおもしろいところはあった。（お股真っ二つとか、オパーイつけてなりすましとか）なのでクライモリ的なB級スプラッタとして振り切ってみればよかった。それにしても微妙だけど。途中出てきた人形抱えてる女の人はホームレスなんか？その割には小綺麗だったし、登場させる意味があったのか。ホラーにありがちだけど、さっき殺したばっかりの死体の血がもうすぐ固まっているのはなんだ、そういう細かい美術が気になってしまう。大事なシーンみせろや、とかその謎アップなんなんとか、ビックリシーンさんざん焦らしといてヌルッととか気になるところがいっぱいあってなんか…他の人のコメントで見たけど殺人鬼が銃使っちゃあかんでしょみたいなすげー確かにって思った。アートピエロを名乗って殺害方法に拘ってたのに、ピンチになったら普通に銃使い出して、反撃もめっちゃもらってだらだら攻防する様はダッサいよね。冨樫義博が漫画を描くならつまらない映画をたくさん見ろ、そしてどうしたら面白くなるか考えろ。と言っていたけど、これはかなり勉強になると思う。,2022/11/03
3.9,冒頭、中盤、最後全部が理不尽だし何がなんだかなんだけど、残虐ピエロの強さ、意味不明。でもそれが良いし、それを見たかった。ゴア描写も遠慮もなければ躊躇もない、血で血を洗う鮮血！！！続編は映画館で失神する人がいるくらいらしいので、期待してます。,2022/11/03
4.0,かなり好きだなと思った自分をやばいなって思った。古典ホラーへの愛を感じた。,2022/11/02
3.8,怖かった。2がすごい評判なので、まあ観とこかってノリで観たらすごかった。ハロウィンの夜に背の高い白黒のピエロに出会う女の子達のお話。ピエロのキャラ完璧すぎん？殺人ピエロとしてこの世にいきなり現れたみたいな、過去も動機も一切存在しないような、全く掴めない感じ。何があっても声を出さない。そんで不死身、瞬間移動のチートキャラ。いいと思います。ずっと身構えとかないとひたすらビクってなる。なんでトドメ刺さないのとか、サッサと逃げろよとか、なんで屋内にいくのとか、途中から突っ込むのをやめるくらい登場人物はお約束に縛られてるけど、ピエロもその分舐めプしてるから許せる。お姉さんの回想的なストーリーなのね。様子おかしくなっちゃってかわいそう。,2022/11/02
3.7,ハロウィンちょっと過ぎちゃったけど、テリファっちゃいました🎶続編が大変な話題を呼んでます【テリファー】女の子2人がピエロに執拗に襲われてちゃうお話(笑)変態ピエロでしたねー！アート・ザ・クラウン！そのネーミングセンスはいかにwww「ギコギコしちゃうぞ」のキャッチコピーの方が良いねー。この変態ピエロがとことんヤバくて良かったですねー！徹底的に残虐に！強烈だったなぁーーー。一言も声を出さず、不気味なジェスチャーでアピール！メインは女体逆さ吊りですよね。おっぱーーーい！って思ってたらお股からギコギコギコギコ、、、。ソッチからギコギコなのねwwwいやぁー強烈でしたよーーー。グロかったよね(笑)もう解体ショーじゃないのさ。顔面ランタントイレでうん子アートあと女装な！あれはヤバいでしょwwwイカレすぎてて笑ってしまった(笑)登場シーンは100パー変なおじさんだったけどね！そんなヤバいピエロマックスなハードなゴア描写が多くて楽しかったです。一方で気になるとこもちらほらと！1番はさ、トドメ刺しちゃえよっていうシーンが多すぎました(笑)逃げるために一刺ししたのに、すぐ逃げる！そこで追い討ちをかけてメッタ刺ししたら、すぐエンディングむかえられるのに！「立ってこい！ぶっころしてやるー！」立って来る前に追い討ちだろぉー！そんなシーンが多くてワンパターンに感じてしまいましたねーーまぁさ、ピエロのイカレっぷりを見たいだけだったからいいんですけどねー。ヒロインがネーブ・キャンベルに似てました🎶このピエロって、、、不死身なの？！そこも疑問よねーーー続編はさらにパワーアップと波紋を呼んでますね！見ますともっ🎶,2022/11/02
3.0,グロ好きにはもってこいの映画だけれど、ストーリー自体はそこまで惹かれるものがなかった…,2022/11/02
3.0,ストーリーに特に意味は無いしゴア描写は安っぽいしホラー描写は怖くないし演出は古臭いけどB級ホラーとしての良さは満点。なんも考えたくない時に勢いで見るとスッキリできそう。213,2022/11/02
3.4,ただグロい。。。途中でヒロイン交代するのはあんまない感じで面白いなーって思ったけど、、、ってか、あれで死なないって結局犯人人間じゃないよね,2022/11/02
3.8,ハロウィンの夜、酔った2人の女の子が殺人ピエロに遭遇するお話。低予算B 級ホラーであることをしっかり自覚しているようで、余計な演出とかドラマ性とかは削ぎ落としてただ殺人ピエロに追われるスリルと人体破壊の面白さだけに振り切っているところがとても愛おしい作品です。また、変なふざけ方はせずにシリアストーンを保っている、でもところどころで「怖面白い」くらいのギャグセンスもあるバランス感も大好きです。おかげで、序盤の導入部を除けば全編が怖いシーン。「こいつ怪しくないか......？大丈夫か......？」「ちょいちょい、後ろにおるんちゃうか......？大丈夫か......？」「うわ、出た！」みたいに緩急は付けながらも、常に緊張感が持続していく感じは大好きな『ハイテンション』にも通じる気がします。だから好きなんだと思う。とにかくピエロさんが一言も喋らないのが良いですね。完全に不条理を体現しているだけの存在で、でも反撃されると意外と弱いところなんかに人間味があってギャップ萌えしちゃいます。顔が普通に怖い。掃除のお兄さんとかヤバいおばさんとかもなんか不気味で良かったですね。惜しかった点としては、被害者側がけっこう反撃できるのに誰もトドメを刺さないのが、数回なら良いけど毎度毎度のことでちょっとイラッとしちゃうってとこすかね。あと、オープニングエンディングの枠部分が意味深な割に特に伏線回収だとかはなくそのまんま終わるのが肩透かしではある。とはいえ、スラッシャー系のB級ホラーで観たいところだけで構成された潔さが堪らない傑作でした。続編も楽しみ。,2022/11/02
3.7,ハロウィンの帰りに寄ったダイナーでやばいピエロが店員殺してて大変な事になる映画スタートからすごいB級感あってウケます。ピエロがすごい愛嬌ある！女の子捕まえて2回もハンマーで殴るフェイント！！焦らしすぎ！！よくあのノコギリで真っ二つに出来たな！！鈍器とかノコギリとか使ってたのにいきなり飛び道具！！そしてカツラかぶってる姿がほぼマリリンマンソン ！！一方的にやるだけじゃなくて一応ダメージを受けるのも好感が持てます。続編も楽しみです！,2022/11/02
3.4,ホラー大苦手の私はどこから来るかどこから来るかってほんとに怖かった見てるだけで体力消費するし定期的に残り時間確認して「まだ○分もこれが続くの⁉️」みたいな笑ある程度グロに耐久はあるから、とりあえずビックリにやられた笑笑あたしが相当ビビりなだけだからグロに耐久あれば恐らく大丈夫,2022/11/02
3.5,2が話題となってるので、気になり1を。理由も正体もわからずただひたすら殺し続けるピエロは謎で気持ち悪かった（良い意味）最後まで飽きずに見れたし2も観ようとおもう。股裂きは痛そうだった.,2022/11/02
3.8,・最初の顔はコメディだったけど、展開がいろいろあったのとグロさがあった。・タラが結構反撃してたのは良かった。・ピエロは細いし怪我してるはずなのに強すぎだし不死身でむかつく。しかもやられてても声を出さないし、初めての建物のはずなのに全部把握しすぎ。,2022/11/02
3.2,2を見るか見ないか迷ってとりあえず1見たけど完全にグロに振り切った映画でした！この手の映画のオープニングやエンドロールの字体のセンスの良さよ。ピエロのあの靴。ミッキーみたいなやつ。あれ格好いいんだよなぁ〜あの靴どうやったら手に入るんだろう。拷問器具がたくさん出てきたから捕まってからの拷問系かと思ったけど、意外とそうでもなかった。あとあのお母さん(？)との化学反応がもう少し見たかったな笑,2022/11/02
3.6,これぞホラーって感じするピエロの動きと表情の作り方がツボで好み狂っちゃったお母さんとピエロのシーンが不気味すぎて良い、化学反応起きそうだったけど起きなかったのウケるけど登場人物アホで腹立つ鍵開ける時後ろも気にしろやなんで外逃げれたのにまた中戻るんだよ最後はなんなんや人間じゃなかったんかい,2022/11/02
3.6,｢こんなグロシーンやってみて〜…やっちゃお！☺️｣みたいなノリの軽そうなグロホラーでもホラーの王道パターンをあえて外してきたり、普通にストレートに来たり構成的な楽しさはある。あとテリファー(ピエロ？)とは何者なのかって謎がいい感じに続編物商業ホラーとしてピッタリな感じはする。,2022/11/02
3.0,アルティメットサイコパスいやーグロい見終わった後はずしっと心が疲れた…初期の登場人物が中盤でアッサリ全員ドロップアウトトドメ刺しとけよ！っと何度か突っ込みましたがなるほど最後の展開的にできないのね最初にも言ってたけどウィンチェスター兄弟の案件だ！逆さ吊りのお姉さんは頭蓋骨以外軟骨だったんでしょうかあっさり捌けたのでびっくり人形のお母さんは病んでたかもだけど助け求めてるとき割とまともじゃない？娘奪われたときはブチギレるのかと思ったけどあっさりやられちゃったねこりゃ続編はしんどいわ,2022/11/02
3.0,グロい映画で色んな殺害シーンが出てきます逆さ吊りにされてノコギリで切られてるのが1番恐怖だったかな,2022/11/01
2.9,グロくて血だらけだけど、所々ウケを狙ってる？って所はある。最初に出てきたあの目を抉った人がお姉さんだった事に驚き。ピエロの素顔を見てみたいとだけで、とにかく訳が分からない。,2022/11/01
2.9,2が話題なので見たことがなかったこちらを鑑賞。グロが安っぽいだとか展開だとか感じるのはあるけど、結構容赦なく人が死んでったりあの結末が個人的には振り切ってていいなとは思った。なんと言ってもなーんにも喋らない声がでないピエロがとんでもなく不快感があってすごい笑笑口が聞けなかったり鼻先の黒点のデザインだったりが秀逸だなーと思った。それに関しては一見の価値あり。,2022/11/01
2.6,グロ映画だが、要所要所のシーンが日本のお笑いチックで笑ってしまう。最後まで人間のような犯人だが、最後の最後でえ？人間ちゃうの？という謎な展開。意味なくグロで締めるラスト。ホラー苦手な人間としては怖さもあったが映画としては完全なB級。褒めてません。,2022/11/01
2.8,OPの特殊メイクがあまりにチープで不安になるゴリゴリのグロ映画。でもナイフや糸鋸で骨まで切断できんでしょーと途中萎える。主人公:タラは黒髪ミディアムで「スクリーム」とか「ラストサマー」を思い出す。しかし「IT」「道化してるぜ」みたいにピエロ犯人のホラーが多いせいでアメリカ人はピエロ恐怖症になるのでは？このピエロ死なないし、人間臭いくせに声を一切あげない所はすごいけど。。最後まで何者なのかはわからないまま。邪悪の化身か何か？,2022/11/01
3.0,この作品って日本公開したの？全然知らなかった。続編が本国で話題になっていると言う記事を見て配信で鑑賞。開始から比較的早いタイミングでピザ屋の店員がやられる訳だがピエロのあの作った表情とタラを見つめる死んだ目が印象的だ。タラとドーンの乗るクルマのタイヤがパンクさせられている所からの展開は、ダリオ・アルジェントを彷彿させる所もあるが股裂ゴア描写は自分こ守備範囲を超えていて萎えてしまった。そしてハロウィンよろしく倒しても復活してくる様は、マイケル・マイヤーズの様でキリが無さそうな雰囲気だ。いずれにしてもゴアが好きなホラーファン向けの作品と言えるだろうね。,2022/11/01
3.5,「テリファー2」上陸前に鑑賞してみたのですが・・・、聞いていたほどの怖さではありませんでした。怖いというよりは、気持ち悪い？のほうが勝っちゃいました。もしかしたら「2」の怖さが段違いなのかもしれませんが、スプラッター映画好きの方であれば難なく鑑賞できると思います。個人的には、ピエロ男が殺人を犯した理由が気になりましたね。(そこが分からないところもまた、この作品の醍醐味なのでしょうか)ちなみに、エンディングは結構衝撃的でしたので、最後までご覧いただくことをお薦めします！,2022/11/01
3.8,物理的な攻撃もボコボコに受けるピエロに笑ってまった。中指を立てるな!笑コメディや！！最近落ち込んでたけど、観たらなんか元気でた。2も観たくなる。グロ系で元気出るんこれぐらいちゃう？ありがとう。グロ要素は全然許容範囲だけど、内容はカオス。神出鬼没でもないし、走らないし、そこにいる。ここや！ってとこで出てくるし、喋らないし、チャーミング。ただ、知らない人らが無駄に可哀想な死に方する。あ、音楽は不気味！聞き覚えあるやつ！私もずっと歯を剥き出しにしておかねばね。おしまい◡̈⃝︎⋆︎*テリファーへの愛情が止まらない。#元気出たからハイスコア！,2022/11/01
2.5,2をやるというので見てみたけど久しぶりに具合悪くなるグロだった血も肉もめちゃめちゃ飛び散るからなにか食べながらとかはやめたほうがいい。ひたすらに殺されていくのでなんかもうわあ。,2022/11/01
0.0,全ての登場人物に無駄でダルい掘り下げもなく、ただただ無慈悲で残酷な死と暴力が生み出す恐怖が純粋に描かれる傑作ホラー。続編が楽しみ。,2022/11/01
1.8,展開が早くて良い。登場人物が馬鹿ばっかりでイラつく為、逆にピエロに殺される爽快感が芽生える。,2022/11/01
3.0,ピエロ嫌いなかた、さらに嫌いになると思います。笑結構グロいので、ちょっとトラウマになります。ハラハラしたい人にはおススメですね。はやく助けを呼びなさいって途中何回も思ってみてました。,2022/11/01
0.0,残虐ではあるけど「痛めつけてやろう」って気がない、純粋に本人が殺すために殺す清々しいグロ。笑顔キショ怖。,2022/11/01
3.0,2すごいって聞いたから見てみよって思ってみたら普通のスプラッター映画だった最初のレストランのシーンのピエロの不気味な感じがいい、あとデザインも。,2022/11/01
3.0,ハロウィンの夜にピエロの扮装をした殺人鬼が巻き起こす惨劇を描いた物語。世界観の説明もそこそこに始まる、血しぶき塗れのハチャメチャな内容が最高w刃物に拘るのかと思いきや、ピンチの時はアッサリと銃を使う殺人鬼の臨機応変さも良かったなぁとw,2022/11/01
2.7,昨日見たグロテスクなだけでストーリーはあんまし、なんじゃそれというシーン多い,2022/11/01
3.5,なにこの誰も救われない絶望的な展開、、お姉ちゃんが近づく必要ないとこ行ったり、開かないってわかってるはずの扉ずっとガチャガチャして後ろ無警戒だしイライラ😩ビビらせ方とかは王道でここで絶対くるじゃん！ってとこでしっかりくるんだけど、甚振るような殺し方が今まで見てきた中でもトップレベルで鬱。,2022/11/01
