score,review,date
3.3,見た目が普通に怖すぎる。喋らない奴が執拗に追いかけてくるのめちゃくちゃ怖いよね。そしてとてもグロかった🫠あやつなんで死なないの...,2022/10/25
2.8,鋸ってそんなに切れ味良くないよ！あと急に銃使うのはズルいぜピエロちゃん！なんか続編もあるらしいこの作品。こういうのを見る度に“あぁやっぱイーライ・ロスとかジェームズ・ワンって凄いんだな”っていうのを思い知る。“ピエロは怖い”のその先があんま無かったなぁ。,2022/10/25
1.7,テリファー2が失神・嘔吐した人続出と話題になっているのを知って怖いものみたさで1を視聴ゴア描写は偽物感あるけどちゃんとグロい首ちょん切るシーン、キツかったラストは霊的存在くさい演出で世界観が取っ散らかった気がする,2022/10/25
3.5,最後の雑さなぁ〜B級スプラッターピエロの主役キャスト、メイクさん、照明さんに拍手〜ってかんじ,2022/10/25
4.1,面白かった！彩度を上げてる？ような感じでめっちゃオシャレ。そしてなんと言ってもメインキャラのアートザクラウンが魅力的すぎる！ちょっとふざけたり、ツッコミどころあって笑えるシーンあるけどゴア描写で中和してる笑2も期待します🤡,2022/10/25
3.0,いつも思うけど この手の人たちって不死身よね。捌き具合がとてもスマートグロシーンよりもやつがひょっこり顔を出すまでのお化け屋敷的な緊張感で吐きそうになる⤵︎ ︎あと 姉妹の顔面がよく似てた。2022-283,2022/10/25
3.0,久しぶりにひたすらグロいホラーを観た。一言も喋らないピエロが不気味。多々早く逃げろよと言いたくなる場面あり。続きが気になる！,2022/10/25
3.1,最後まで目的も分からずじまいの不気味な殺人ピエロ　キャラと見た目は割と好きなんで誰もピエロにトドメを刺さないのか,2022/10/25
4.4,相当ヨカッタです！なって欲しいことになるし、意味の分からなさも、ツッコミどころも、映像クオリティも、文句なしデス！ただし物語性の点でK点超えず…！,2022/10/25
0.0,テリファー2がグロすぎて公開中止になったので、とりあえず前作のコレ観てみた作り物感満載あえてなのか？誰も本物を見た事ないから、リアルに作れない？追われる恐怖、心理戦にフォーカス当てすぎ反撃され何度刺されても声一つあげない殺人ピエロ、えげちー警官に詰められて口から脳にかけて 自ら銃ぶっぱなしたけど、解剖医の喉に掴みかかってたのは なに？殺人ピエロ、冒頭 人間がフェイスペインティングしてたやん人間だろ？不死身なの笑う,2022/10/25
4.0,今観てきた。グロすぎなのとサイコパスすぎなんよ。股からゴリゴリ斬られるとか想像もしたくない。気持ち悪くなったから健全なアニメ観る。,2022/10/25
1.3,吹き替え頭とケツがそう繋がるんだろうなぁ〜とわかった上で観賞🤡日本のハロウィンも惨殺事件とかあったらえぇのになぁ〜💀,2022/10/25
4.0,いままで観てきた殺人ピエロの中で、ここまで何考えてるかわからんやつはいなかった！そしてこれ本当に2016年の映画？まともじゃないストーリーの中で、狂ってる女の人がいちばんまともに見えるシーンがよかった。,2022/10/25
2.0,色んな殺し方あるなぁと感心しちゃった白塗りお歯黒ピエロハゲイケおじ,2022/10/25
3.0,ん？って感じだった。なにこれ？これピエロに被害に遭った人が殺しを繰り返すループってこと？にしてはピエロの身長とか体格とか、辻褄が合わない気がするけど。どこかのネタバレ解説サイトを見ないとわからん…9.5割なかなかにグロシーンでした。オンパレードグロ！,2022/10/25
3.3,グロい表現に力が入っているグロくて気持ち悪いけど怖くはなかったかな,2022/10/25
2.0,うーん普通だった。ハロウィンの夜にピエロコスプレの殺人鬼に襲われるというありがちなストーリー。途中のかくれんぼのシーンが古いホラー映画のテイストになっている様に感じた。,2022/10/25
3.4,古のスラッシャー映画からの影響を感じる演出満載で、ゴア要素の強い惨殺シーンもツッコミ所満載なんだけど、殺しのバリエーションも豊富だし、クラウンの格好をした殺人鬼「アート・ザ・クラウン」のヴィジュアルや佇まいがとても不気味でいい。（終始言葉を発しないのも◎）,2022/10/25
2.5,かなり派手で鮮やかなホラーだった。ピエロが主役の映画初めてみた。ピエロって人間が仮装しただけの存在だと思ってたけど違った。,2022/10/25
3.0,続編では失神者が出たようで。そんなに凄いのかと📎放置から解放。【Summary】白と黒を基調とした装いの特徴あるピエロ。その正体は快楽殺人鬼。【Pick up】・グロレベル高□両手で押し込みおめめグチャ□カボチャじゃなくて人間の頭でジャックランタン□女性を逆さ吊りからの～割れ目から糸鋸切りで真っ二つ□踏みつぶしで頭グチャ□顔の皮剥いで食す※グロ耐性ない人は絶対観ちゃいけないやつ・優しい被害者達ピエロに抵抗→倒す→逃げる→捕まるのループ。殺すのは抵抗あるにしても、倒れたところで致命傷を与えれば良いのになーと思った。【Free!】ストーリーを楽しむというより、グロが見たい人向け。22#145─────────────────────なかなか時間が取れず、久々の更新となりました。観れるときは観ようと思ってますが、落ち着くまではしばらくこの状態が続きます💦TLもあまり追えておらず、スローペースとなりますが引き続きお付き合い頂けると幸いです！,2022/10/25
3.5,"""Terrifier""u-nextにて視聴2が公開されるとの事で視聴グロよりのグロがすごい怖くは無かったけど友達の女の子が....のシーンはさすがにびびった笑2022-289本目",2022/10/25
3.3,2がホラーマニアの間で話題なので1を見にきた。グロい。殺人ピエロに何かしらの理念なりバックグラウンドがあればまだマシだけど一切の描写がない直球の殺戮。そりゃこのゴアみをゴリゴリにアップグレードしたら失神者も出るのはわかる。新しいホラーアイコンが誕生するかどうか。これが市民権を得るのは無理なんじゃないかなぁ,2022/10/25
3.0,★3　ハロウィンの夜。ピエロのような格好の男に人が次々に猟奇的な殺され方をする話。このピエロに殺されそうになって助かった女性がテレビ出演を果たす。（彼女はピエロに顔を食べられたから顔はぐちゃぐちゃ）その司会の女が彼女と対面してとても気味が悪かったと悪口。司会者の女は彼女に目をえぐられ亡くなる。ピエロも最後殺されたと思いきや、生きていてそのまま行方をくらましている。顔食べられた女の人が猟奇的に司会者を控室で殺したシーンを見て彼女＝ピエロなんじゃないかと思ったり。それにしてもピエロは何者だったんだ？！,2022/10/25
3.0,お茶目なバッタモンのマリリン・マンソンもどきなピエロ殺人鬼が遊び回るのをひたすら見続けるキャラクター映画で、正直面白くはないけど、見ごたえはあります。スプラッターとしてはど真ん中、ストーリーはあって無し、落ちは最初から丸見え、ただしグロ描写は全力投球。ただ殺されるだけの登場人物を、パントマイムの様に振る舞い痛ぶり続けるアート・ザ・クラウンがとっても魅力的なんです。,2022/10/25
3.5,2が話題だから見てみたそもそもホラー映画は苦手だしストーリー性とか求めてないからこんぐらい説明も脈絡も無くバッタバッタとスプラッターショーを展開してくれた方が楽しめた,2022/10/25
2.4,ハッピーハロウィンってことで、今の季節にぴったりではあるが、このピエロには美学がなかった。これならよっぽどシーハルクの最終回の方がグロい。ピエロなりに殺しに凝ってる風だったのに、拳銃使うのはなんだかなぁ、と。あと演出がワンパターンすぎて、繰り返し感が強くて飽きた。,2022/10/25
3.1,全力で気持ち悪い😊コッテリ系ラーメン食べながら見たら食がまぁ進まない進まない,2022/10/25
1.0,ホラー映画好きの友達に勧められたけど、やっぱし観なければ良かった…グロすぎるし、後味悪すぎ。怖さで言えば、確かに怖いけど。定番の展開と言えば定番。,2022/10/25
0.0,ピエロ最高に気持ち悪い反撃されてんのに最強すぎるし最後が？🤔ナイフ？で人は切断できんやろってツッコミ満載,2022/10/25
2.8,ピエロが気持ち悪かった。外で会った所からレストラン？での感じが一番怖いかも。笑グロいけど、リアルさを通り越しててそういうシーンは怖くなかった。ただ、お姉ちゃんが追いかけられてるところは怖いというか気持ち悪いというか、、、とりあえずピエロ自体が気持ち悪いし怖かったし、生き返ったのなら、もう人間じゃなくて怪物なんだよなぁ、、、2がゲロ吐く人多いっていうのをネットで見て気になってたんだけど、これは全然だったからどうなんだろう？これは短いから良かったかな！,2022/10/24
3.4,キラーのキャラはいいねなんか他作品とコラボした方が輝きそう,2022/10/24
3.3,殺人鬼系映画の中で殺人鬼にイライラしたの久しぶりもっと芸術性のある殺しをして欲しい,2022/10/24
4.0,80年代の王道スラッシャーから、血糊の量とグロテスクさ以外はアップデートする様子が微塵もない潔さ。ピエロの不気味さはこれまでにないレベルで、閉塞感と緊張感が続き、ここぞというところで容赦ないゴア描写がやってくる。クラシック・スプラッター、スラッシャーが好きなら観て損はないと思う。近年よくあるメタ的視点やドラマ性の高さ等はないので、あくまで懐古的な視点で楽しむ映画かと。私は好きです。80sスラッシャー大好きなので。#ハロウィンマンス洋ホラー強化月間#ハロウィン映画,2022/10/24
2.6,（何も理解してない段階ならまだしも、殺人ピエロに追われてるのわかってるんだから）そんな事してないでさっさと逃げろ、みたいなシーンを減らして欲しい,2022/10/24
3.5,理不尽スプラッターならかなり好きな感じだけど、猟奇的な殺人鬼なのか？モンスターなのか？ちょっとハッキリしないのがもったいないかな…,2022/10/24
3.0,ゴア描写多め被害者みんな一回は反撃してるのに追い込みせずに逃げるってどうなん？きっちり止め刺しとけよただのサイコパスかと思ったけど最後があれ？ってなった2もあるみたいだしジェイソン的なポジション狙ってんのかな,2022/10/24
3.5,通り魔の殺人映画なんだと思ってたら結構超常的な感じなんだねえ。このあたりすでに規制が強くてこういうグロテスクな映像って敬遠されがちだったと思うんだけど（SAWが同い年だからそうでもない？）だいぶ頑張って撮ってたと思う。股からノコノコして半裂にするのあれもっとやばい悲鳴出そうだろうとか思ってたんだけど中途半端に見せるんじゃなくて全部きっちり見せてくれるのすごく良かった。良いかはわからない。普通に凶悪な映像が見れるので次のやつもできたらみたいなあ。,2022/10/24
2.8,都合よすぎ展開にイライラするランキング上位悪趣味でひねりもなく面白くない,2022/10/24
3.2,"印象的でインパクトのある映画でした。この映画の特徴といえば、やはりグロでしょう。グロにかなり力の入った映画です。グロやホラーに慣れてない人は相当キツイ映画です。個人的には、途中から一気にグロくなくなったような気もします。それも含めて途中からはグダグダして中弛みだった印象です。主人公のタラがかなり美人で好きでした。まあまあ楽しめます。続編""Terrifier 2""がアメリカで公開されており、途中で観客が退場したり失神したり嘔吐したりと話題になっています。個人的にはこの1作目が少し物足りない気もしたので続編を必要とする映画だと思っています。続編は日本で劇場公開されるのでしょうか？(無理そうだな…)配信でならまだ考えますが、劇場では正直観たくない映画です>_<",2022/10/24
3.0,スプラッターなんだけどピエロの演技がうまくて本当に気持ち悪かった。表情の不気味さがすごい‼︎ラストはそうしちゃうかぁってかんじだけど普通に面白かったです。,2022/10/24
3.0,2作目の事がニュースになっていたので見てみる事にした。見始めは低予算のクソ映画かな〜と思ったけど、進むうちに面白くなった。ピエロだけにお茶目な面もチラホラwさあ、ピエロの正体は何なんでしょう？,2022/10/24
0.0,監禁と拷問と暴行NG 指チュパして頭預けて甘えんのもきもちわる… ほんと気持ち悪い 2観れません,2022/10/24
3.3,U-NEXT、Filmarksのランキングで上位におるからどんなもんかなと思って見てみた！古い映画かと思ってたけど2016年の作品なのね。最初から最後までずっとグロいサイコパススプラッター映画！ストーリーとか伏線とか特になくただただピエロが人殺しまくってるのもはや清々しいまであったな。金髪女うざかったから殺された時ちょっとにっこりしちゃった(殺し方えぐすぎたけど)最近食欲爆発してたけど見事に食欲減退したのはありがたい🥹笑笑やっぱピエロって怖いよね〜ハロウィンって感じ#うどんこ2022#うどんこ2022年10月,2022/10/24
2.0,2作目が失神者出たとか、そんなニュースで話題になっていたので1作目のこちらを。残虐殺人ピエロが殺戮しまくる話。それだけの展開なので、糸鋸でザクザク以外にこれは！となるところがなく、ちょっと寂しい。冒頭の女性の顔も低予算故？ちょうどこわさがなくなるぐらいのいいかんじのデザインになってしまったような。,2022/10/24
3.1,全編「そうはならんやろ〜」で満載のスプラッター映画。舞台装置も、殺人鬼の不死身設定も、何もかも「いやいやいや…」ってなって冷めちゃう。30分くらいにまとめてくれ。頭踏み潰すゴア描写なんて、ライアン・ゴズリングもやってたじゃないか。,2022/10/24
3.6,ひたすら人が死ぬのを見せられてる感じの映画です。グロシーンや人が死ぬシーンをいっぱいみたい人向けりストーリーとかはちゃんと作られてない感があるので、ストーリー重視の方にはオススメしないかも。スプラッター系の映画なので、血が凄い飛び散るし色々ぐちゃぐちゃになるシーンとかもいっぱいあって、グロシーンなどが見たかった私からすればなかなか良かった。けど、視聴後にうわぁ感は少し残ってたのでご飯前に見るのはオススメしません。,2022/10/24
0.0,ピエロが一切喋らないところにどこか人間ではない感じがあってぞわぞわしたでも反撃されて痛そうにしてるピエロ見てめっちゃ笑った続編早く日本に来ないかな！？,2022/10/24
2.8,物語性が、まったく無くて、ただひたすらに殺人ピエロが怖い理不尽！B級ホラー好きだけど、ビジュアルだけグロくて怖いだけあんまり好きじゃないかなー、私は…なんで、殺人ピエロは殺しまくるのか？そして、逃げる人たちは、なんで戦わないで、ひたすら逃げるだけなの？甘い！！もっと反撃して！！そして鍵だらけの建物で、なぜピエロは先回りしてるの？と、腑に落ちない昔は、13金とかエルム街が好きで、キャーキャーできたのになーやっぱり、ピエロには魅力を感じないし、あいつ嫌い（ジェイソンたちは、愛嬌があったな）,2022/10/24
3.5,【最強ピエロに殺されちゃう！】「IT/イット」や「クラウン」「道化師てるぜ！」など名だたるホラー作品にユーモアという名の色どりを与えてくれるピエロ。赤いお鼻の代わりに黒いホクロをつけたチャーミングな彼は、残虐非道の殺人ピエロ！！！⚠こんな要素を含んでいます注意⚠・過激な人体破損やグロ描写・ピエロ恐怖症・ジャンプスケア等のびっくり表現【好きな点】・B級ホラーにしては造形が緻密・容赦ないゴア表現・斬新な死体遊びや殺し方が満載！【微妙な点】・主人公が定まらない・人間関係の作り込みが中途半端・ジェイソン系のキャラ全体的なグロ描写は結構リアルで真新しい！！！一般人のサイコパスが人を切り刻むより、道化師が表情豊かに惨殺していく様子がスカッとするよね。倫理観は完全にぶっ飛んでいるので、その分死体遊びにバラエティーがあります！スプラッター好きはぜひチェック。構成的な話をすると、主人公っぽいビッチやその姉、暗がりに住む人形を愛でている初老の女、そしてネズミ駆除の男性など人間関係の展開に期待できそうだったけど意外と関連性はない。ジェイソンみたいに生き残りとの関係を見ていくのも面白いかと考えたけど、それこそピエロ自体が不死身設定なのはちょっと興ざめ。ピエロなんだし、生身の人間の弱みが見えるからこそ、それを耐え忍ぶ姿こそが道化なのにな～～～～と個人的な感想です。,2022/10/24
3.0,かなりグロい。殺人鬼もので恐らく1、2を争うレベルでヤバい。楽しみながら危険も顧みずスリルを味わってるような人を殺す事になんの抵抗もないモラル的にアウトな描写が多かったわ。ビジュアルもピエロの格好で不気味に笑みを浮かべる表情は可笑しくもあり怖さも感じ他の作品でもピエロのキラーキャラいるけど今作のキャラが1番怖かった。何人殺すんだってくらい殺戮の限りを尽くしていて🥲ブロンドの美女が身体真っ二つに裂かれるとこCG使わないでやってるから尚更リアルに見えました。股がシュンてなる痛さ😣黒髪のバンギャみたいなお姉さん生きていて欲しかったわぁー。後もうちょいで逃げれたのに...「テリファー2」が今、アメリカで上映され途中退席や気分が悪くなる方が大勢出たという事で前作以上にパワーアップした過激描写と上映時間も2時間以上あるらしく大作だったらわかるけどスプラッターで2時間以上って珍しいなと。延々と血みどろの惨劇を目にする訳だから気が滅入るのも分かるわ。日本公開される事に期待！,2022/10/24
3.8,2が話題になってたので鑑賞。ひたすらにグロいB級スプラッターホラー。映像の感じとか古そうに見えるけど結構新しめの映画だし、ソウが好きなので個人的には好き。時々笑えたりする演出があったりするのがB級のいいところ自分的には面白かったです。ピエロが怖い人とグロいの無理な人はやめた方がいいかも、ネタバレありただストーリーがない、(まぁB級ホラーだしな)あと銃で若干冷めちゃったな、、そして最後人外なんかいというオチがなんかな〜、、まぁでも声一切あげない&絶対に倒れないので人外でもいっか2あるしってなっちゃった,2022/10/24
