score,review,date
3.5,ピエロの背景が知りたくなった。久々にスプラッターみた、お肉が食べたくなるね。一言も喋らなくて正体が分からなく目的不明、快楽殺人なのが不気味さを増して恐怖を感じて良かった。ツッコミどころはあるけどこういうB級スプラッターは気にしたら負けだと思ってる。,2022/11/17
3.0,B級映画の良さが集結したグログロ作品ちょうどいいグロさ加減の1作目。果たして2作目はいかがなものか。#盆栽2010年代ホラー,2022/11/17
3.2,2の日本公開が決定したので視聴ストーリーは特になく、所々人形感もあったりでグロ耐性の強い方にはやや物足りないかも...刃物の演出が苦手な僕は意外と楽しめました！ゴア表現や流血の量は流石ですので、2も楽しみ！,2022/11/17
3.0,よくあるスプラッター映画。ピエロがいい気持ち悪さで最初は楽しめましたが、展開が全然ないので飽きてしまいます、、ピエロから逃げる時にいっつも鍵開かないしツッコミどころ満載,2022/11/17
1.0,グロいだろうけど、それ以外見る点がないかなという感じでした。ツッコミどころも多いので気にし出したらキリが有りません。,2022/11/17
0.0,とにかくグロい映画知らない~？って聞かれたら、テリファー！って言うときゃ何とかなる聞いてくる人居るんかな,2022/11/17
1.5,とにかくグロテスク。最後まで意味がよく分からなかった。早送りで見ました。,2022/11/17
3.5,ピエロきもすぎる。グロい。あとイライラする。はよ逃げろよ。倒しきれよ。とどめさせよ。。,2022/11/16
3.5,内容的にはよく分からないところもチラホラだったけど、スプラッターホラーとしてはなかなか面白かった。,2022/11/16
3.3,みんな生き残る気ないだろと終始イライラ。グロ描写はかなりのビジュアル。,2022/11/16
3.0,全米が吐いたというテリファー2で存在を知り観てみることに。ハロウィーンの夜、ピエロの男が次々と理不尽に殺人を犯していく。テンポ感よく、程よい緊張感、グロさ(?)で進んでいくストーリー。惨殺シーンはCGに頼らず手作り感があって良かった👏テリファーの素性がしれない感じがホラーニューキャラクター登場だなと。エンターテインメント性が強いスプラッター映画って感じでした。2も機会があったら観てみたいです◎,2022/11/16
3.9,一度見たことがあるけど、テリファー2が話題になっていてテリファーを観ている人が羨ましすぎる！ということで、2は観れないので1を再鑑賞！笑この映画は最初から最後まで手を抜かず、精一杯グロを出してきている感じがしていいなと思った。スプラッター映画は沢山観てきているが、そんな自分でもやはりこの映画は痛々しい。殺人ピエロが声を出さないところ、笑顔なところがとても不気味。ドナルド・マクドナルドをはじめピエロはほとんど全て苦手なのだが、このピエロの顔は特に苦手かも？と思った。ピエロの着ている服が白色なので、ラストに向かうにつれて血で赤く染まっていくのが恐ろしい。意外にも笑えるところが数カ所ある。もっとグロい映画ないのー？っていう人におすすめ。とにかく2の日本公開を願う！,2022/11/16
3.6,80分でサクッと終わるグロホラー。ストーリーはあってないようなもの。ピエロ？と呼んでいいのかよく分からんが、白い顔したイカれたやつがひたすら殺していく映画。スリルとゴア描写を楽しむだけの映画。殺しに必死さがないのが余計あたおか感を出してていい。音で驚かしてくるシーンが多くあったのもあって、終始ドキドキしてました。逆さに吊して真っ二つはとても良かったと思います。ゴア描写という意味ではそこまでなので（なんなら最初の女の人が一番怖い笑）、やべえ人間を見る！ってのが割とメインかな。もっと殺しに工夫があったりもう少しグロテスクだったりSAWみたいな驚きがあると、なお良かったと思います。続編も楽しみです。,2022/11/16
0.0,想像できる範囲での最悪の事態が全部起きるので、そういう気分な人はどうぞ（？）,2022/11/16
4.0,ナニコレ大当たりなんだけど。今のところクラウン系の映画で1番ドキドキした！好き！このクラウン大好き。日本語版ジャケットも最高に笑えるwww『ギコギコしちゃうぞ！テリファー』たのむから変なところで笑わせないでwwwwwチープで不気味なクラウンが笑うとなーんかこっちも笑えちゃうんだけど、笑った後に「これ…笑って良いやつ…？」ってとっても不気味な後味があるよねえ。お笑いとホラーは紙一重ってまさにコレ。細身で長身、面長ゴツゴツした顔のクラウン。クリーチャー好きとしてめっちゃ推せる！！！最高ヴィジュアル！！そしてB級感漂うグロさがたまんない笑笑このクラウンの俳優はだれ？？？ほんとに普段から道化師を職業にしていそうなほど動きのキレと見せ場があって終始息が詰まった。まぁただ主人公が変わる前までの方が緊張感があってよかったかなぁと思う。あとは人間の強さであってほしかったな。そんだけ！その後も全然面白いのだけど。あとも一つだけ言うと、おねえちゃんは来た道戻って逃げてくれ笑そしてしっかり痛い描写ではこっちも顔が歪んでしまうような、リアルな痛さあり。なんて不気味なの。しゅき！！！,2022/11/16
2.5,話題になっていたのでみました。ピエロこっっわ‥これはほんとに気持ち悪いやつ。ホラーは好きなんだけど、こういうのは苦手（笑）このポスターも色味とか嫌い。,2022/11/15
3.2,目的がわからない、びっくりさせるためだけのB級ホラーこれがスプラッター映画っていうの？,2022/11/15
3.5,久々に見たけど、みんな詰めが甘過ぎて生き延びる気あんのかと言いたくなる。タラとか何で刃物から木の板っきれにわざわざ武器チェンジしたよ。やる気あんのか。奴が不気味過ぎて少しでも距離取りたい気持ちは分かるけど、奴に負けないほどの殺意を持って臨んだ結果やられてほしい。ヴィクトリアはあの顔で生かされたの拷問だと思うわ。私も安楽死がいい。あのピエロ、動きと顔芸がまさに狂気。エミリーをあやす手つきがめちゃくちゃ優しいのがこれまた怖い。そして一言も声発さないであの存在感って凄い。あんなのがどこからともなく現れてこっち見ててピザ屋について来て近くの席からじっっっ…と自分を見てきてたらその時点で警察呼ぶレベルの怖さだよね。多分仮装してなくてもあの鼻と汚過ぎる口元と死んだ目だけでめちゃくちゃ怖いと思う。個人的に検死の最後のシーンが微妙。拳銃自殺したんだよね？何で死んでないの？人間じゃないの？ええ？？？っていう。不死身モンスターじゃくて、気狂ったただの人間であってほしい。,2022/11/15
3.4,面白さでいうとストーリー性があまり感じられないので途中で飽きてしまいそうだけど、好きな人はたまらないかも。また、グロさでいうと気味が悪く、非常にグロいので苦手な方は閲覧注意ですね。ピエロの無言が終始、気味を悪くさせ独特な世界観を生み出している。そして、ピエロの俳優さんも演技は素晴らしい。求める要素で、好みや評価が大きくわかれる作品。,2022/11/15
2.2,2倍速で見るくらいで丁度いいです。え、そこであんた死ぬんかーい！と思わず言ってしまいました。,2022/11/15
3.0,グロすぎてやばい。ストーリー性はないし、グロスリラー系だったとは。ケツからぶった斬るのはやばいよ。あんだけ拷問道具持ってて結局銃ってとこがえー…ってなる。最後は自殺かと思ったら生きてて謎だった。血が噴き出る感じがB級ホラーだな。,2022/11/15
1.5,うーーーん。。。私が求めているホラーとはちょっと違った。ただ残忍なだけで面白味がなかった。その残忍さすら、おふざけにしたいのかシリアスにしたいのか、中途半端な感じ。狙う相手に一貫性がないし、とにかく出会った人を殺していくだけ。こういうホラーはマーダーの知能が低かったり、何かしらの弱点があるからこそ怖さが際立つものだけど、そういうのもない。期待していただけに残念。唯一良かったのは、90分もたたないうちにサクッと観れることぐらいかな。,2022/11/15
2.7,グロいっちゃグロいけどまぁって感じ。ストーリー性は無いなぁ。雰囲気の気持ち悪さは良かった。,2022/11/15
4.7,これぞまさに気狂いピエロ、道化死ていた低予算スプラッターのジャンルとしては、ほとんど満点に近いんじゃないかなクラファンで集めた製作費の30倍以上の興行収入というサプライズヒットも納得古き良きスプラッター映画の定番を踏襲しつつも、捻りを加えたプロットフィルムのトーンやオープニングのクレジットから垣間見える、80年代のスプラッター映画へのリスペクトアートを次世代のホラーアイコンにするぞ、という製作陣の気概もしっかりと伝わってきた顔面破壊のスクリーンイン、ヒロインチェンジ、脇役のキャラクタリゼーションが逸脱で、勝手ながらこれから期待できる監督だと思うインタビューを受けていたビクトリアを見て、いつだかコネチカットでチンパンジーのトラビスに顔を引きちぎられた女の人を思い出した,2022/11/15
3.0,噂のギコギコシーンですが、被害者の美女が叫んですらいないし、真っ二つ後にブラブラ吊り下がった身体も、あれ本物の人間の身体ってああはならないよね？ゴム感すごくて、半分になったダッチワイフみたい。何か作り物感あって普通でした。逆さ吊りになった時のおっぱいが美しすぎるので注目せよってレビューを何かで読んだけど、シリコン入れてない…？ってなった。見返し確認はしてませんwwどっちかというと、お店でタラをじっと見つめてる時の方がピエロ気持ち悪&不気味すぎて、そこが恐怖のピーク。しかしまあホラー映画ってみんな逃げないし、どんどん一人で暗がりの奥に進んでいくし、なぜかそこかしこに鍵かかってるし、ご都合主義的でモヤる。てか女子ふたり、特にタラ超美人と思ってたのに顔打たれて顔面破壊描写がっつりめにあっさり途中退場してびっくり。顔面破壊描写はピザ屋の店長とかもあって頑張ってました。お姉さん、なんで最初にキャスター殺したんだろ？腹たったから？ピエロが伝染った？ピエロが結局人外の何かでちょいと残念。検死解剖の時にシート取ったらがっつりピエロと目が合うとかドキッとする。そういうピエロのやばさの演出がうまい！,2022/11/15
3.0,年齢制限されてる作品だけに直球なグロゴア表現はあるけどストーリーは皆無だから何も考えずにワーワーなってくスプラッター映画を見たい時とかに良いんかなぁただラストのピエロが復活するとこ見ると個人的には微妙かも🤔悪霊とか不死身なモンスター系キャラになったんかな,2022/11/15
3.0,「アートくんを新世代の大スターにするぞ！」というスタッフの気概が伝わってきます。とてもいいです。見ている人間は最初はピエロに怯え、主人公たちをハラハラ見守っているのですが、その主人公たちはヤバ男に自ら絡む、あんなどヤバい殺人現場を見た後に犯人を真正面から煽り散らかす、ちょっと攻撃するだけでトドメを刺さない、逃げられそうなタイミングで全然逃げない、など、ホラー映画の被害者にありがちなイライラする行動を繰り返すため、段々とアートくんを応援しはじめ、行け行けーッ！となるのです。ラストシーンまで辿り着いた時には、もうアートくんのファンになっています。続編も楽しみにしていますが日本公開、あるかなぁ。劇場が無理でも、アマプラさんネトフリさん、期待しています！,2022/11/15
2.5,まぁ、B級ホラーがっつりゴア表現あり殺人鬼は鈍臭いし、特に深さも感じない。ただただグロい映画で暇つぶししたいならちょうどいいのかも？,2022/11/15
4.2,今作の続編が、嘔吐者やら失神者やら続出！って話題になってたので、そういえば見てなかったなーと思いこの機会に鑑賞。いやー思ったより全然良かった！ストーリーはあってないようなもんなんだけど、尺も短いしテンポも悪くないし、何より殺人ピエロの｢アート・ザ・クラウン｣がとってもいいキャラですねえ！ビジュアルもスタイリッシュで恐ろしくて、何されても絶対声を出さない徹底ぶり。「ギコギコしちゃうぞ♪」って...と思ってたらwしっっっかりギコギコしてた🥺あれは初めて見る衝撃映像だったなあ🥺とにかくグロくて、それをちゃんと隠さず見せる姿勢に拍手👏結構怖がらせてくれたので、私はめっちゃ満足！,2022/11/15
4.0,アート・ザ・クラウンを見る為の映画。真のホラー好きでなければきっと楽しめない。理由なんて意味なんていらないのだ。何者か？なんてナンセンス。全殺人鬼の中でもトップレベルの殺人センス大好き。,2022/11/15
0.0,便秘薬全部詰め込んだみたいな感じだったぜ表情筋はジム・キャリのーマスクと張り合える,2022/11/15
3.3,ストーリーなんて「ピエロが人を殺しまくる話」で終わるほどに無いに等しいとにかくグロを頑張っているので血が見たい！肉塊が見たい！ときにおすすめ,2022/11/15
2.5,人の身体があんなに簡単に切れるかな？？^ ^ちょいちょいツッコミどころあるから全然みれる。展開も読めるなーて感じ。グロシーンやりたいだけの映画やからストーリーは薄いです^ ^,2022/11/15
3.5,盛大なB級スプラッタのゴア映画あばれるくんがトイレ貸してくれる,2022/11/15
2.6,グロ描写が好き。一言も喋らないピエロが恐怖を増幅させる。まだ、終わっていない。,2022/11/14
3.6,グロい、ただただグロいピエロが恐ろしいんだけれども可愛く見えてくる,2022/11/14
2.0,正直つまらなかった笑笑ストーリー性ないし、ただただハロウィンの日に、怖いピエロが人を次々と酷い殺し方で殺していく。グロ描写だけって感じ。ピエロはずっと無言だし不気味。変な動きするし笑グロ描写はなんか安っちい。笑リアリティはそんなないかも？くだらなすぎて途中からスマホいじってしまうほどでした！ひまつぶしにはいいかも程度！顔はトラウマレベルで怖いけどね。。。あと、展開も、あるある展開。映画見慣れると、次起こる展開わかっちゃうって感じのあれですね。,2022/11/14
2.7,怖いよりもグロさがえぐい😱結局ピエロの犯人像とか被害者についての説明無さすぎ…ピエロがひたすら人殺しするだけの映画。女性の悲鳴がほぼ喘ぎ声だし、ハァハァ息の音がうるさい💢そりゃ隠れててもすぐ見つかるよ😖うっすい内容の割にダラダラと長い。,2022/11/14
2.9,Terrifierテリファーハロウィンパーティー帰りタラ&ドーンが出会ったピエロ姿の男タラを気に入り会う人々殺しながら追っかけて来る逃げ惑うタラストーリーは予想通りただ1つこのピエロがtrance genderだったのが意外で新鮮あの歩き方は変でキモイ。怖いよりグロい。ていうか怖くなくて昔のスプラッター。始終プルプルしてる🤣ラストはハンニバルのGary似💕lyraのブログもよろしく👠 https://lyra4m.com/👠 https://lyriclyra.com/#Terrifier#terrifer#テリファー#horror#ホラー#psychokiller#serialkiller,2022/11/14
3.0,キチガイピエロ🤡の惨殺事件テリファー！名前からしてキチガイパリピの姉さん宙吊りからの胴体真っ二つ被害者は皆間抜け妹・反撃のチャンス有るもトドメ刺さず姉・同上禿・同上警察官👮‍♀️突入発砲💥テリファーご遺体入れ替え作戦大成功何だかよく分からない・・・,2022/11/14
3.0,ハロウィンの夜、若い女性がピエロメイクの不気味な人に命を狙われてしまうというお話激キモでした。ゴア描写は少し安っぽさを感じなくもないのですが、それを差し引いてもグロい、キモイ犯人がとにかく不気味でキモくて…これ以外の感想が出てきません…序盤は友達にちょっと腹が立ってしまいましたが、それを凌駕するほどのキモシーンの連続正当防衛でもっとやってもいいだろ！なんて思うこともちらほら終わり方に関しては、はてなが出てきましたがなんと2があるではないですか機会があれば見たいなと思います。決していい気分になることがないのは言わずもがなの映画でした。,2022/11/14
3.7,ホラー映画としてはシンプルにびっくりするしグロいしで良作だと思う。ただグロすぎ、、体調悪くなるのでお気をつけて、、。真っ二つのとこであぁ、、ってなった、、。復活ピエロこわすぎ🤡,2022/11/14
2.9,ストーリー性はなし。ただ気持ち悪くてよかった◎ ピエロの仕草と表情キモすぎ夢に出てきそう。おい、そこはぶち殺しとけばよかったやろってシーンが多かった。つっこみどろころ多いけど、こわっ！ってなったとこもあってよかったですな,2022/11/14
4.0,強火ゴアのスプラッター映画としては満点に近いと思うけど、人を殺すに至る背景とかテリファー自体が何者でどういった人物かという描写が全く無いからよく分からんストーリー性は無いしそういった、内容を求めて見る映画では無いのだなと。しかし、テリファーのあの顔が映画見終わった後も思い出してしまうくらい印象的で良いスプラッターホラー映画やと思う,2022/11/14
3.6,日曜の夜はこういうクソしょうもない映画を見るに限るわ！ネタバレも何もないしグロ演出全部乗せみたいなジャンク飯絶対に見るか絶対に見ないか別れる作品,2022/11/13
3.4,2022年鑑賞78作目物語性とか無視してテリファー(恐ろしい)に徹した作品。グリーンインフェルノなど見て耐性のある人は楽しめると思う。あの、、、女性になりきるシーンは悪魔のいけにえのレザーフェイスをオマージュしたのかな？？と思った。不条理な恐怖をガンガンぶつけられたって感じ。もう少しでも物語が欲しかったな,2022/11/13
3.3,久々にスプラッター見たが、やっぱ怖くて、一時停止をしながら、気持ちを整えながら見たｗレンタル店のＤＶＤのジャケットでは、「ギコギコしちゃうぞ」と、怖い宣伝文句が書いていたが、作品の中ではまさしくギコギコしていて、これはR１５はなく、R18な作品だなと感じた。ギコギコシーンに関して、ホラー映画という娯楽の中で作り物というのがわかっているが、自分にはけっこうきつかった。ホラー映画はもう見なくてもいいかなと思いつつも、また何かしら見るんだろうな 。結局このピエロ野郎は何者だったのか。ふざけたピエロ顔で、インスタ映えしそうな殺しをしにやってくる。,2022/11/13
3.0,よく見るピエロだったんで視聴結構グロ多めピエロ事態は結構弱い雑魚系のお方,2022/11/13
0.0,ああ股無理股無理あああああああんな切れんよ普通って思わんと無理,2022/11/13
1.9,エログロ好きにはオススメ。自分は最後まで観るのが苦しかったです…,2022/11/13
3.6,グロい！今までみた映画の中でもトップクラスにグロい！でもとてもおもしろかった,2022/11/13
3.7,異色の問題作。公開が2016年なのにも関わらず、1990年代のような映像の作り方はあえてなのか、狙ってるのか。そのあまりのゴア表現に各国で物議をかもしていた本作ですが、個人的な感想としては「スプラッターコメディ」に近い。人なのかどうかすらわからない気味の悪いピエロがあの手この手で被害者一行をいたぶり、血が噴き出して内臓が飛び出る！というスプラッターの要素を強く持ちつつ、至る所に「いやそうはならんやろ！(笑)」ってシーンもたくさんあり、客観的にツッコみたくなる、その塩梅がちょうどいいかもしれない。マーターズやホステルのように単にゴアに振り切って悲惨なシーンをとくとくと見せられ、見終わってから気分が暗くなるスプラッターも最高ですが、テリファーのグロ→笑い→グロ→笑いのローテーションが個人的にはハマった。続編の日本公開が待ち遠しい1本。,2022/11/13
2.9,とりあえずグロいわねってかんじ結構テンポいいほうだと思う〜でも最後のはどういう事？色々考察読みまーす,2022/11/13
3.0,とにかくグロを楽しむ映画って感じでした。所々指の隙間から観るようなシーンがあったけど、豪快すぎて現実感が薄いのもあってどうにか観れました。とはいえ、ストーリーを楽しむものじゃないとわかりつつも、落ちてる工具で鍵を壊さないのとか、動きを止めるまで反撃しないとか、いちいち大きな声を出すのとか、ツッコミどころが沢山あってモヤモヤ。,2022/11/13
3.6,ピエロが終始無言で、殺しの最中もピエロだし、刺されても切られてもピエロなのが怖かったし良かった。死んでるはずの自殺の仕方だったのに生きてるのはこいつ、もしかしたら人ならざるもの的ななにかなのかな？ピエロが無言な代わりに、動きに合わせて効果音を入れてきてたのが映画だからできる演出で、それがピエロだからこその怖さを引き立ててた気がする。動かない怖さもあるんやな…グロかった…,2022/11/13
